issue,title,validator comment,grade,root cause (URL),size
validation-598,```validateVariablePoolHasEnoughLiquidity``` will always revert due to ```balanceOf``` check on wrong address,interesting,Satisfactory,https://github.com/code-423n4/2024-06-size/blob/main/src/libraries/CapsLibrary.sol#L67-L72,113
validation-599,Credit positions with cash less than ```minimumCreditBorrowAToken``` and credit more than ```minimumCreditBorrowAToken``` will not be created while they should,incorrect restriction,Satisfactory,"https://github.com/code-423n4/2024-06-size/blob/8850e25fb088898e9cf86f9be1c401ad155bea86/src/libraries/actions/BuyCreditMarket.sol#L91-L93,https://github.com/code-423n4/2024-06-size/blob/8850e25fb088898e9cf86f9be1c401ad155bea86/src/libraries/actions/SellCreditMarket.sol#L93-L95",57
validation-600, Missing check for zero value of msg.value can cause a DoS attack on the deposit function,,Unsatisfactory,,35
validation-601,Users can not deposit and repay their loans if the contract is paused leading to unintended and uncontrollable overdue liquidations,Acceptable risk but should be noted regardless,Satisfactory,https://github.com/code-423n4/2024-06-size/blob/main/src/libraries/RiskLibrary.sol#L104-L115,37
validation-602,Users can not withdraw and use their borrowed USDC tokens if their collateral ratio is below openingLimitBorrow CR,,Unsatisfactory,,30
validation-603,Users can not delete a BorrowOffer while the protocol is paused leading to an unwanted loans when the protocol continues operating which he will have to pay fees for.,,Unsatisfactory,,35
validation-604,Anyone can bypass ```validateBorrowATokenCap``` check and deposit over the limit calling ```deposit()``` from multicall,"QA, multicall",Satisfactory,https://github.com/code-423n4/2024-06-size/blob/main/src/libraries/CapsLibrary.sol#L19-L44,112
validation-606,Wrong fee calculation when user sells his full ```CreditPosition``` calling ```sellCreditMarket()``` with ```exactAmountIn``` as false,"QA at most, fees",Satisfactory,"https://github.com/code-423n4/2024-06-size/blob/8850e25fb088898e9cf86f9be1c401ad155bea86/src/libraries/AccountingLibrary.sol#L249,https://github.com/code-423n4/2024-06-size/blob/8850e25fb088898e9cf86f9be1c401ad155bea86/src/libraries/AccountingLibrary.sol#L256",153
validation-607,Fees are not taken from the issuanceValue in the liquidateWithReplacement function.,no fee on replacement,Satisfactory,https://github.com/code-423n4/2024-06-size/blob/8850e25fb088898e9cf86f9be1c401ad155bea86/src/libraries/actions/LiquidateWithReplacement.sol#L146,71
validation-608,Incorrect ```creditAmountIn``` calculation in ```getCreditAmountIn``` function when users sells a portion of their ```CreditPosition```,"QA at most, fees",Satisfactory,"https://github.com/code-423n4/2024-06-size/blob/8850e25fb088898e9cf86f9be1c401ad155bea86/src/libraries/AccountingLibrary.sol#L249,https://github.com/code-423n4/2024-06-size/blob/8850e25fb088898e9cf86f9be1c401ad155bea86/src/libraries/AccountingLibrary.sol#L256",110
validation-609,Liquidate doesn't always increase the sender collaterals as per LIQUIDATE_01 invariant,technicality,Unsatisfactory,,58
validation-610, Malicious lenders can create buy credit limit orders without depositing any tokens into the protocol.,,Unsatisfactory,,60
validation-611,"`executeLiquidateWithReplacement` rounds in the wrong direction, breaking an invariant","QA at most, fees",Satisfactory,"https://github.com/code-423n4/2024-06-size/blob/8850e25fb088898e9cf86f9be1c401ad155bea86/src/libraries/AccountingLibrary.sol#L249,https://github.com/code-423n4/2024-06-size/blob/8850e25fb088898e9cf86f9be1c401ad155bea86/src/libraries/AccountingLibrary.sol#L256",31
validation-612,profit margin when liquidating small positions might not be enough to cover liquidator costs ,"QA, small loan profitability liquidation",Satisfactory,https://github.com/code-423n4/2024-06-size/blob/8850e25fb088898e9cf86f9be1c401ad155bea86/src/libraries/actions/Liquidate.sol#L96-L100,37
validation-613,Impact of Variable Pool (Aave v3) Failures on Size Protocol's Liquidation Process,,Unsatisfactory,,41
validation-615,`Multicall` Out-of-Gas Exploitation Enables Front-Running Attacks on Critical Protocol Functions and Can Cause Loss Of Funds,,Unsatisfactory,,331
validation-616, Mishandling of ETH in the [Liquidate::executeLiquidateWithReplacement] can lead to accounting error and siphoning of fund by malicious user,,Unsatisfactory,,33
validation-617,Potential APR Manipulation and Variability Issues in `BuyCreditMarket` function,,Unsatisfactory,,80
validation-620,Post-execution validations in `size.buyCreditMarket()` could lead to DoS/State-Inconsistencies ,,Unsatisfactory,,107
validation-622,"Users are able to split their debt position at no cost, allowing them to delay or even prevent liquidation",no frag fee,Satisfactory,"https://github.com/code-423n4/2024-06-size/blob/main/src/libraries/actions/Compensate.sol#L136,https://github.com/code-423n4/2024-06-size/blob/main/src/libraries/actions/Compensate.sol#L146",38
validation-623,AccountingLibrary's `getCreditAmountIn()` overstates `creditAmountIn` for the given `cashAmountOut`,fee 2 getCreditAmountIn ,Satisfactory,"https://github.com/code-423n4/2024-06-size/blob/8850e25fb088898e9cf86f9be1c401ad155bea86/src/libraries/AccountingLibrary.sol#L197,https://github.com/code-423n4/2024-06-size/blob/8850e25fb088898e9cf86f9be1c401ad155bea86/src/libraries/AccountingLibrary.sol#L207",63
validation-625,Chainlink price feed will return the wrong price for USDC if underlying aggregator hits minAnswer,,Unsatisfactory,,42
validation-626,Risk can be transferred forcefully to unwilling risk takers(borrowers who wants USDC).,,Unsatisfactory,,61
validation-627,"The decimals precision of the `priceFeed` is not handled in `collateralRatio()`, leading to potential wrong valuation ",,Unsatisfactory,,68
validation-628,Lack of Slippage Protection in `size.buyCreditMarket()` and `size.sellCreditMarket()` ,,Unsatisfactory,,123
validation-629,Risk of Overpayment Due to Race Condition Between repay and liquidateWithReplacement Transactions,dangerous race condition,Satisfactory,https://github.com/code-423n4/2024-06-size/blob/8850e25fb088898e9cf86f9be1c401ad155bea86/src/Size.sol#L229-L244,102
validation-630,`isDebtPositionLiquidatable` doesn't account for fees,,Unsatisfactory,,75
validation-631,Borrow Token Withdrawals Blocked Due to Incorrect Opening Collateral Ratio Check,,Unsatisfactory,,92
validation-633,Possible Re-Entrancy in `repay::executearepay` leading to exploitable cases by a malicious user,,Unsatisfactory,,85
validation-634,Possible Re-Entrancy in `repay::executearepay` leading to exploitable cases by a malicious user,,Unsatisfactory,,85
validation-635,Invalid validation in `UpdateConfig.sol` prevents the swap fee apr from being more than the minimum,,Unsatisfactory,,40
validation-639,Withdrawal can fail even if user is not underwater,,Unsatisfactory,,44
validation-64, Reentrancy Vulnerability in executeLiquidateWithReplacement Function,,Unsatisfactory,,344
validation-642,`validateVariablePoolHasEnoughLiquidity` will always fail causing complete DOS to the protocol,interesting,Satisfactory,https://github.com/code-423n4/2024-06-size/blob/main/src/libraries/CapsLibrary.sol#L67-L72,63
validation-643,Market Fees Calculation Issue,"QA at most, fees",Satisfactory,"https://github.com/code-423n4/2024-06-size/blob/8850e25fb088898e9cf86f9be1c401ad155bea86/src/libraries/AccountingLibrary.sol#L249,https://github.com/code-423n4/2024-06-size/blob/8850e25fb088898e9cf86f9be1c401ad155bea86/src/libraries/AccountingLibrary.sol#L256",1050
validation-644,Incorrect Credit Position Update in `CreateCreditPosition` Function,,Unsatisfactory,,56
validation-645,Incorrect Validation of BuyCreditMarket,,Unsatisfactory,,81
validation-646,Missing Validation for `maxDueDate` Exceeding Maximum Tenor in `BuyCreditLimit` Library,,Unsatisfactory,,61
validation-647,Lack of circuit-breaker check in `PriceFeed.sol`,,Unsatisfactory,,57
validation-648,`maxDueDate` is not checked against the `block.timestamp + state.riskConfig.maxTenor` value,,Unsatisfactory,,67
validation-65,Invalid comparison when computing the liquidator's reward in `executeLiquidate`,units,Satisfactory,https://github.com/code-423n4/2024-06-size/blob/8850e25fb088898e9cf86f9be1c401ad155bea86/src/libraries/actions/Liquidate.sol#L96-L99,153
validation-651,Oracle will return wrong price if price goes out of chainlink's minanswer/maxanswer,,Unsatisfactory,,23
validation-652,Inability to Compensate Debt with Credit of Equal Due Date,,Unsatisfactory,,56
validation-653,The `validateBorrowATokenIncreaseLteDebtTokenDecrease` is incorrect and can be easily bypassed,"QA, multicall",Satisfactory,https://github.com/code-423n4/2024-06-size/blob/main/src/libraries/CapsLibrary.sol#L19-L44,35
validation-654,Persistent Zero Profit for Protocol in Liquidation Events under Specific Market Conditions,,Unsatisfactory,,107
validation-655,The [selfLiquidate::executeSelfLiquidate] is missing a step to account for transferring collateral to the lender and any other entity after self Liquidation,,Unsatisfactory,,43
validation-656,Debt Token Repayment Mechanism Allows Users to Exploit USDC Depreciation,,Unsatisfactory,,47
validation-657,Credit can be sold forcibly as `forSale` setting can be ignored via Compensate,Forceful for sale,Satisfactory,https://github.com/code-423n4/2024-06-size/blob/main/src/libraries/AccountingLibrary.sol#L118-L119,99
validation-658,"`borrowOffer` can be replaced by calling `sellCreditLimit`, so that `buyCreditMarket` and `LiquidateWithReplacement` can be bypassed.",,Unsatisfactory,,192
validation-659,Overdue fees potentially penalize collateralization,,Satisfactory,https://github.com/code-423n4/2024-06-size/blob/8850e25fb088898e9cf86f9be1c401ad155bea86/src/libraries/actions/Liquidate.sol#L105-L108,42
validation-66,Inconsistent fees in `sellCreditMarket` when passing amount as credit or cash,"QA at most, fees",Satisfactory,"https://github.com/code-423n4/2024-06-size/blob/8850e25fb088898e9cf86f9be1c401ad155bea86/src/libraries/AccountingLibrary.sol#L249,https://github.com/code-423n4/2024-06-size/blob/8850e25fb088898e9cf86f9be1c401ad155bea86/src/libraries/AccountingLibrary.sol#L256",194
validation-662,`NonTransferrableScaledToken` uses wrong unscaled calculation.,inverse scaling system?,Satisfactory,https://github.com/code-423n4/2024-06-size/blob/main/src/token/NonTransferrableScaledToken.sol#L94-L100,46
validation-663,Inconsistent ETH Balance Handling in Multicall Deposits,,Unsatisfactory,,109
validation-664,When calculating `creditAmountIn` and `creditAmountOut` the `interest rate` is applied on top of the `fragmentationFee`,fee 2 getCreditAmountIn ,Satisfactory,"https://github.com/code-423n4/2024-06-size/blob/8850e25fb088898e9cf86f9be1c401ad155bea86/src/libraries/AccountingLibrary.sol#L197,https://github.com/code-423n4/2024-06-size/blob/8850e25fb088898e9cf86f9be1c401ad155bea86/src/libraries/AccountingLibrary.sol#L207",68
validation-665,Incorrect Fee Calculation in Credit Fractionalization Scenario,fee 2,Satisfactory,"https://github.com/code-423n4/2024-06-size/blob/8850e25fb088898e9cf86f9be1c401ad155bea86/src/libraries/AccountingLibrary.sol#L197,https://github.com/code-423n4/2024-06-size/blob/8850e25fb088898e9cf86f9be1c401ad155bea86/src/libraries/AccountingLibrary.sol#L207",105
validation-666,Incorrect ETH Deposit Amount Calculation in Deposit Library,,Unsatisfactory,,96
validation-667,Round Completeness Check Omission in PriceFeed Contract,,Unsatisfactory,,66
validation-668,Unchecked Maximum Slippage in Liquidation Exposes Protocol to Market Manipulation and Disproportionate Gains for Whales,,Unsatisfactory,,78
validation-669,Lack of Slippage Protection in Deposit Functions,,Unsatisfactory,,94
validation-670,Insufficient ETH handling in `executeDeposit` Function,,Unsatisfactory,,72
validation-671,PriceFeed contract fails to handle Chainlink aggregator minAnswer/maxAnswer thresholds,,Unsatisfactory,,52
validation-672,No storage gaps in `SizeView.sol`,,Unsatisfactory,,23
validation-673,Any one can call `Size.claim` function thus depriving the lender of extra interest accrual,,Satisfactory,https://github.com/code-423n4/2024-06-size/blob/main/src/libraries/actions/Claim.sol#L48-L60,57
validation-674,Insufficient Handling of Deviation Threshold for ETH/USD Price Feed on BASE L2,,Unsatisfactory,,114
validation-675,Potential Misconfiguration of PriceFeed Contract on BASE Mainnet L2,,Unsatisfactory,,96
validation-676,Incorrect APR Calculation for Exact Tenor Matches in Yield Curve Interpolation,,Unsatisfactory,,71
validation-677,Delegatecall Vulnerability in Multicall Implementation,,Unsatisfactory,,71
validation-678,No Storage Gap for Upgradeable Contract Might Lead to Storage Slot Collision,,Unsatisfactory,,29
validation-679,borrowers face a loss when selling or buying credit by market,,Unsatisfactory,,115
validation-68,Current design of the system makes it very hard for certain users to not get fragmented,,Unsatisfactory,,125
validation-680,Precision Loss in Scaled Token Burns Due to Incorrect Rounding,,Satisfactory,https://github.com/code-423n4/2024-06-size/blob/8850e25fb088898e9cf86f9be1c401ad155bea86/src/token/NonTransferrableScaledToken.sol#L77,55
validation-682,Reorg Vulnerability in Contract Initialization Process,,Unsatisfactory,,111
validation-683,Lack of slippage control in market operations,,Unsatisfactory,,141
validation-684,Inconsisstency in the way `sellCreditMarket()` and `buyCreditMarket()` handels the `validateVariablePoolHasEnoughLiquidity()` check,,Satisfactory,https://github.com/code-423n4/2024-06-size/blob/8850e25fb088898e9cf86f9be1c401ad155bea86/src/libraries/actions/BuyCreditMarket.sol#L195,71
validation-685,Whales can force overDue liquidation via block stuffing,,Unsatisfactory,,59
validation-686,SellCreditMarket's incorrect maximum cash amount and credit calculations impose hidden fees on the borrower,"QA at most, fees",Satisfactory,"https://github.com/code-423n4/2024-06-size/blob/8850e25fb088898e9cf86f9be1c401ad155bea86/src/libraries/AccountingLibrary.sol#L249,https://github.com/code-423n4/2024-06-size/blob/8850e25fb088898e9cf86f9be1c401ad155bea86/src/libraries/AccountingLibrary.sol#L256",116
validation-688,Liquidations can't be profitable due to wrong decimals used in `executeLiquidate()`,units,Satisfactory,https://github.com/code-423n4/2024-06-size/blob/8850e25fb088898e9cf86f9be1c401ad155bea86/src/libraries/actions/Liquidate.sol#L96-L99,52
validation-689,Vulnerabilities in Borrowing Mechanism Due to Limit Orders Not Cleared When Borrower Reaches Max Borrow Limit,,Unsatisfactory,,42
validation-690,DOS possible when selling credit through market,,Unsatisfactory,,30
validation-691,lender can not liquidate self even though loan is overdue unless borrower's debt position is not underwater. ,,Unsatisfactory,,54
validation-693,Inflexibility in Adjusting `crLiquidation` Value in Smart Contract Settings,,Unsatisfactory,,37
validation-694,The `SwapFee`  is accounted twice in the `AccountingLibrary.getCreditAmountIn` function,,Unsatisfactory,,69
validation-695,Multicall does not work as intended,total supply,Satisfactory,"https://github.com/code-423n4/2024-06-size/blob/8850e25fb088898e9cf86f9be1c401ad155bea86/src/libraries/Multicall.sol#L29,https://github.com/code-423n4/2024-06-size/blob/8850e25fb088898e9cf86f9be1c401ad155bea86/src/libraries/Multicall.sol#L37",398
validation-696,Missing Access Control,,Unsatisfactory,,51
validation-697,`Size.buyCreditMarket(BuyCreditMarketParams)` race condition can force many transaction to revert in normal circumstances,,Unsatisfactory,,107
validation-699,Compensate with `RESERVED_ID` can be used for protocol DOS via slicing credit position where attacker is the borrower to the minimal allowed pieces,"QA most likely, but still something to consider",Satisfactory,https://github.com/SizeCredit/size-solidity/blob/fbfe6aa84c2a3ef1ded776cda7a079542a3cdef8/src/libraries/actions/Compensate.sol#L119-L126,74
validation-70,"A borrower can force set other lender's credit position for sale, by calling compensate and passing `RESERVED ID`",Forceful for sale,Satisfactory,https://github.com/code-423n4/2024-06-size/blob/main/src/libraries/AccountingLibrary.sol#L118-L119,130
validation-701,Users Can Buypass Borrow Token Cap via Manipulation of Debt Token Supply,total supply,Satisfactory,"https://github.com/code-423n4/2024-06-size/blob/8850e25fb088898e9cf86f9be1c401ad155bea86/src/libraries/Multicall.sol#L29,https://github.com/code-423n4/2024-06-size/blob/8850e25fb088898e9cf86f9be1c401ad155bea86/src/libraries/Multicall.sol#L37",113
validation-702,Discrepancy in the `swapFee` calculation during cash-for-credit operation,"QA at most, fees",Satisfactory,"https://github.com/code-423n4/2024-06-size/blob/8850e25fb088898e9cf86f9be1c401ad155bea86/src/libraries/AccountingLibrary.sol#L249,https://github.com/code-423n4/2024-06-size/blob/8850e25fb088898e9cf86f9be1c401ad155bea86/src/libraries/AccountingLibrary.sol#L256",71
validation-704,Incorrect Liquidator Reward Calculation Due to Mismatched Token Denominations,units,Satisfactory,https://github.com/code-423n4/2024-06-size/blob/8850e25fb088898e9cf86f9be1c401ad155bea86/src/libraries/actions/Liquidate.sol#L96-L99,53
validation-705,Rounding issue in `getCreditPositionProRataAssignedCollateral` calculation.,,Unsatisfactory,,93
validation-706,"`YieldCurveLibrary.getAPR` rounds in different directions, returning unexpected results",,Unsatisfactory,,38
validation-708,Any existing loan can be bought by anyone,immediate for sale exploit,Unsatisfactory,https://github.com/code-423n4/2024-06-size/blob/8850e25fb088898e9cf86f9be1c401ad155bea86/src/libraries/AccountingLibrary.sol#L81,83
validation-709,PriceOracle will use the wrong price if the Chainlink registry returns price outside min/max range.,,Unsatisfactory,,51
validation-710,BuyCreditMarket charges extra swap fees as AccountingLibrary's `getCashAmountIn()` and `getCreditAmountOut()` use incorrect base amount,"QA at most, fees",Satisfactory,"https://github.com/code-423n4/2024-06-size/blob/8850e25fb088898e9cf86f9be1c401ad155bea86/src/libraries/AccountingLibrary.sol#L249,https://github.com/code-423n4/2024-06-size/blob/8850e25fb088898e9cf86f9be1c401ad155bea86/src/libraries/AccountingLibrary.sol#L256",156
validation-711,"Due to wrong math, liquidation incentive is always a dust amount, exposing protocol to risk of insolvancy",units,Satisfactory,https://github.com/code-423n4/2024-06-size/blob/8850e25fb088898e9cf86f9be1c401ad155bea86/src/libraries/actions/Liquidate.sol#L96-L99,76
validation-712,The Market Maker does not pay the `swapFee` and it is the taker who pays the `swapFee` in the `executeBuyCreditMarket` function,,Unsatisfactory,,59
validation-713,"`BuyCreditMarket.executeBuyCreditMarket` limits the maximum cash amount input more than is expected, causing calls that should be valid to fail",fee 2 getCreditAmountIn ,Satisfactory,"https://github.com/code-423n4/2024-06-size/blob/8850e25fb088898e9cf86f9be1c401ad155bea86/src/libraries/AccountingLibrary.sol#L197,https://github.com/code-423n4/2024-06-size/blob/8850e25fb088898e9cf86f9be1c401ad155bea86/src/libraries/AccountingLibrary.sol#L207",43
validation-714,`Size.sellCreditMarket(SellCreditMarketParams)` race condition can force many transaction to revert in normal circumstances,,Unsatisfactory,,96
validation-715,The rewards assigned to the Liquidators are insignificant (almost non-existing),units,Satisfactory,https://github.com/code-423n4/2024-06-size/blob/8850e25fb088898e9cf86f9be1c401ad155bea86/src/libraries/actions/Liquidate.sol#L96-L99,86
validation-716,reentrancy in accountinglibrary.sol,,Unsatisfactory,,23
validation-717,Insufficient access control on Default admin which can compromise the protocol,,Unsatisfactory,,38
validation-718,Liquidators can be front-runned ,,Unsatisfactory,,78
validation-719,Liquidate sets `collateralRemainderCap` incorrectly as only overcollateralization part needs to be compared to the remainder,,Satisfactory,https://github.com/code-423n4/2024-06-size/blob/8850e25fb088898e9cf86f9be1c401ad155bea86/src/libraries/actions/Liquidate.sol#L105-L108,80
validation-72,ISizeAdmin contract imported but not inherited.,,Unsatisfactory,,25
validation-720,User can split a credit into multiple credits without paying fragmentation fee,no frag fee,Satisfactory,"https://github.com/code-423n4/2024-06-size/blob/main/src/libraries/actions/Compensate.sol#L136,https://github.com/code-423n4/2024-06-size/blob/main/src/libraries/actions/Compensate.sol#L146",86
validation-721,Withdraw can be DoSed by an attacker sending debt tokens to user's address,debt not transferrable?,Unsatisfactory,,100
validation-722,AccountingLibrary's `getCashAmountOut()` inflates swap fee by using the wrong base,,Satisfactory,"https://github.com/code-423n4/2024-06-size/blob/8850e25fb088898e9cf86f9be1c401ad155bea86/src/libraries/AccountingLibrary.sol#L197,https://github.com/code-423n4/2024-06-size/blob/8850e25fb088898e9cf86f9be1c401ad155bea86/src/libraries/AccountingLibrary.sol#L207",118
validation-725,Lenders can claim far more tokens,,Unsatisfactory,,46
validation-726,Incorrect validation in `SellCreditMarket.sol` causes the function to fail unexpectedly and prevents from borrowing being performed,,Satisfactory,https://github.com/code-423n4/2024-06-size/blob/8850e25fb088898e9cf86f9be1c401ad155bea86/src/libraries/actions/UpdateConfig.sol#L119-L123,40
validation-727,It's possible to manipulate new credit position `forSale` flag via `createCreditPosition()`,Forceful for sale,Satisfactory,https://github.com/code-423n4/2024-06-size/blob/main/src/libraries/AccountingLibrary.sol#L118-L119,90
validation-728,Wrong calculation of futureValue of DebtPosition in simple lending & borrowing case,"QA at most, fees",Satisfactory,"https://github.com/code-423n4/2024-06-size/blob/8850e25fb088898e9cf86f9be1c401ad155bea86/src/libraries/AccountingLibrary.sol#L249,https://github.com/code-423n4/2024-06-size/blob/8850e25fb088898e9cf86f9be1c401ad155bea86/src/libraries/AccountingLibrary.sol#L256",124
validation-729,Malicious actor can enforce liquidation to a user,,Unsatisfactory,,42
validation-73,Incorrect `withdrawUnderlyingTokenFromVariablePool` Implementation,,Unsatisfactory,,38
validation-730,`executeBuyCreditMarket()` returns incorrect value for liquidity availability control ,fee 2 getCreditAmountIn ,Satisfactory,"https://github.com/code-423n4/2024-06-size/blob/8850e25fb088898e9cf86f9be1c401ad155bea86/src/libraries/AccountingLibrary.sol#L197,https://github.com/code-423n4/2024-06-size/blob/8850e25fb088898e9cf86f9be1c401ad155bea86/src/libraries/AccountingLibrary.sol#L207",59
validation-74, Re-Entrancy Vulnerability in repayDebt Function,,Unsatisfactory,,91
validation-75,Insufficient Validation in Liquidation Function Leading to Potential Fund Loss,,Unsatisfactory,,49
validation-76,Liquidators have the choice to liquidate a different amount of positions under the same circumstances,,Unsatisfactory,,98
validation-77,Vulnerabilities in `executeDeposit` Function Endanger Deposit Process,,Unsatisfactory,,59
validation-79,"Invalid CR validation in `Size::compensate`, blocking users from compensating their loans",,Unsatisfactory,,154
validation-80,Some functions doesn't utilize the whenNotPaused modifier,,Unsatisfactory,,22
validation-84,"Ether passed to  withdraw() function will be lost for the caller, can be stolen by other depositor",,Unsatisfactory,,70
validation-86,Storage Could Be Corrupted During an Upgrade,,Unsatisfactory,,36
validation-87,Muticall deposits entirely bypass the borrowAToken cap,total supply,Satisfactory,"https://github.com/code-423n4/2024-06-size/blob/8850e25fb088898e9cf86f9be1c401ad155bea86/src/libraries/Multicall.sol#L29,https://github.com/code-423n4/2024-06-size/blob/8850e25fb088898e9cf86f9be1c401ad155bea86/src/libraries/Multicall.sol#L37",71
validation-88,"Invalid CR validation in `Size::withdraw`, blocking liquidatable users from withdrawing their borrow tokens",,Unsatisfactory,,100
validation-90,"using Contract's native token balance does not provide any guard in Multicall, hence will revert",,Unsatisfactory,,88
validation-91,unhandled return value for transferFrom() call during self liquidation,,Unsatisfactory,,52
validation-92,Whales can DoS the usage of the protocol,,Unsatisfactory,,32
validation-93,Some users will be required to borrow a higher amount of tokens than others,incorrect restriction,Satisfactory,"https://github.com/code-423n4/2024-06-size/blob/8850e25fb088898e9cf86f9be1c401ad155bea86/src/libraries/actions/BuyCreditMarket.sol#L91-L93,https://github.com/code-423n4/2024-06-size/blob/8850e25fb088898e9cf86f9be1c401ad155bea86/src/libraries/actions/SellCreditMarket.sol#L93-L95",40
validation-94,Numerous different ways for users to create offers that are impossible to take,,Unsatisfactory,,36
validation-95,Fragmentation fees aren't being paid in the context of partial repayment in `Size::compensate`,no frag fee,Satisfactory,"https://github.com/code-423n4/2024-06-size/blob/main/src/libraries/actions/Compensate.sol#L136,https://github.com/code-423n4/2024-06-size/blob/main/src/libraries/actions/Compensate.sol#L146",106
validation-96,Borrowers might not be able to withdraw their borrowed tokens due to a very insufficient check,,Unsatisfactory,,45
validation-98,Malicious lenders can force borrowers into fragmenting their credit positions,insufficient APR protections,Satisfactory,https://github.com/code-423n4/2024-06-size/blob/8850e25fb088898e9cf86f9be1c401ad155bea86/src/libraries/actions/SellCreditMarket.sol#L107-L118,127