issue,title,validator comment,grade,root cause (URL),size
validation-100,CreditPosition is forsale immediately after created ,"intended, insufficient elaboration",Unsatisfactory,https://github.com/code-423n4/2024-06-size/blob/8850e25fb088898e9cf86f9be1c401ad155bea86/src/libraries/AccountingLibrary.sol#L81,58
validation-107,[M-02] Incorrect rounding down in `PriceFeed::getPrice()` function can lead to precision loss,,Unsatisfactory,,23
validation-108,Users can not to buy/sell minimum credit allowed due to exactAmountIn condition,incorrect restriction,Satisfactory,"https://github.com/code-423n4/2024-06-size/blob/8850e25fb088898e9cf86f9be1c401ad155bea86/src/libraries/actions/BuyCreditMarket.sol#L91-L93,https://github.com/code-423n4/2024-06-size/blob/8850e25fb088898e9cf86f9be1c401ad155bea86/src/libraries/actions/SellCreditMarket.sol#L93-L95",122
validation-110,Users can not withdraw USDC when they are below the opening limit borrow CR,intended,Unsatisfactory,,53
validation-111,Wrong calculation of `liquidatorReward` in `executeLiquidate`,units,Satisfactory,https://github.com/code-423n4/2024-06-size/blob/8850e25fb088898e9cf86f9be1c401ad155bea86/src/libraries/actions/Liquidate.sol#L96-L99,37
validation-113,Users can deposit USDC above the AToken cap,"QA, multicall",Satisfactory,https://github.com/code-423n4/2024-06-size/blob/main/src/libraries/CapsLibrary.sol#L19-L44,36
validation-114,A attacker can fill up the whole block at near the end of a loan to prevent the borrower from repaying and then profit from the liquidation process,blockchain related,Unsatisfactory,,30
validation-116,Mismatch between the code and documentation could lead to DoS ,admin action,Unsatisfactory,,122
validation-119,Malicious actor could change core protocol's configuration params,,Unsatisfactory,,38
validation-120,`liquidateWithReplacement` and `buyCreditMarket` can be DoS in some cases,,Unsatisfactory,,96
validation-121,deposit `underlyingBorrowToken` can be DoS,,Unsatisfactory,,87
validation-122, `asigneCollateral` variable is incorrectly rounding down,,Unsatisfactory,,119
validation-123,Lack of validation for `cashAmountOut` in `SellCreditMarket` when `exactAmountIn == true` allows creating a loan without fee,"QA at most, fees",Satisfactory,"https://github.com/code-423n4/2024-06-size/blob/8850e25fb088898e9cf86f9be1c401ad155bea86/src/libraries/AccountingLibrary.sol#L249,https://github.com/code-423n4/2024-06-size/blob/8850e25fb088898e9cf86f9be1c401ad155bea86/src/libraries/AccountingLibrary.sol#L256",117
validation-124,Lender has to have a borrowOffer to exit early,,Unsatisfactory,,105
validation-125,Lack of validation for `cashAmountIn` in `BuyCreditMarket` when `exactAmountIn == false` allows creating a loan with only `1 AToken` fee,"QA at most, fees",Satisfactory,"https://github.com/code-423n4/2024-06-size/blob/8850e25fb088898e9cf86f9be1c401ad155bea86/src/libraries/AccountingLibrary.sol#L249,https://github.com/code-423n4/2024-06-size/blob/8850e25fb088898e9cf86f9be1c401ad155bea86/src/libraries/AccountingLibrary.sol#L256",114
validation-126,Malicious user can reduce victim's credit amount,,Abstain,,40
validation-127,Bad debt cannot be liquidated when contract is paused,Acceptable risk but should be noted regardless,Satisfactory,https://github.com/code-423n4/2024-06-size/blob/main/src/libraries/RiskLibrary.sol#L104-L115,35
validation-128,"Old borrowOffer lingering can affect all future newly acquired credit positions, leading to unintended transactions ",,Unsatisfactory,,99
validation-129,The calculation in the credit fractionalization situation may lead to manipulation of credit amount,,Satisfactory,https://github.com/code-423n4/2024-06-size/blob/8850e25fb088898e9cf86f9be1c401ad155bea86/src/libraries/AccountingLibrary.sol#L253-L255,63
validation-137,"Protocol's liqiudation profit is fully relying on the loan's collateral remainder, forcing the protocol to earn inconsistent rewards when liquidating loans of same debt",Relies on alleged remediation,Unsatisfactory,,216
validation-138,Wrong check when `buyCreditMarket` is been called with `param.exactAmountIn` equal to true.,incorrect restriction,Satisfactory,"https://github.com/code-423n4/2024-06-size/blob/8850e25fb088898e9cf86f9be1c401ad155bea86/src/libraries/actions/BuyCreditMarket.sol#L91-L93,https://github.com/code-423n4/2024-06-size/blob/8850e25fb088898e9cf86f9be1c401ad155bea86/src/libraries/actions/SellCreditMarket.sol#L93-L95",123
validation-141,Incorrect calculation of the cap on the liquidation reward leads to loss of funds,units,Satisfactory,https://github.com/code-423n4/2024-06-size/blob/8850e25fb088898e9cf86f9be1c401ad155bea86/src/libraries/actions/Liquidate.sol#L96-L99,74
validation-142,Missing a necessary validation for tenor which can allow the tenor to be lower than the min threshold set by the protocol safety parameter,,Unsatisfactory,,56
validation-143,Borrower always can DoS a Lender trying to exit credit early.,,Satisfactory,https://github.com/code-423n4/2024-06-size/blob/8850e25fb088898e9cf86f9be1c401ad155bea86/src/libraries/actions/Compensate.sol#L139-L145,123
validation-144,Attaching payable modifier to external functions not handling msg.value will lead to locking of funds,,Unsatisfactory,,33
validation-145,The `borrowATokenCap` can be bypassed,"QA, multicall",Satisfactory,https://github.com/code-423n4/2024-06-size/blob/main/src/libraries/CapsLibrary.sol#L19-L44,126
validation-146,"Approvals can be revoked by the token owner, leading to liquidations being reverted",,Unsatisfactory,,45
validation-147,Wrong unscale could lead to stuck amount,QA,Unsatisfactory,,102
validation-148,Borrowers can deny lenders that are trying to early exit a position,,Unsatisfactory,,58
validation-150,Borrowers can avoid liquidations under certain conditions,,Unsatisfactory,,69
validation-152,Users can avoid paying fragmentation fees,no frag fee,Satisfactory,"https://github.com/code-423n4/2024-06-size/blob/main/src/libraries/actions/Compensate.sol#L136,https://github.com/code-423n4/2024-06-size/blob/main/src/libraries/actions/Compensate.sol#L146",72
validation-154,Inability to perform partial liquidations allows huge positions to does not get liquidate ,,Unsatisfactory,,48
validation-155,The `collateralRemainderCap`  is not the correct cap,,Satisfactory,https://github.com/code-423n4/2024-06-size/blob/8850e25fb088898e9cf86f9be1c401ad155bea86/src/libraries/actions/Liquidate.sol#L105-L108,130
validation-159,"Because of a decimal issue, the liquidator gets next to nothing as a liquidation rewards when liquidating a borrow position",units,Satisfactory,https://github.com/code-423n4/2024-06-size/blob/8850e25fb088898e9cf86f9be1c401ad155bea86/src/libraries/actions/Liquidate.sol#L96-L99,142
validation-161,Whales might not be able to get liquidated due to no way to partially liquidate,,Unsatisfactory,,24
validation-162,Users might not be able to withdraw USDC from the protocol,,Unsatisfactory,,40
validation-163,User could sell its credit without intention,intended,Unsatisfactory,,290
validation-165,Inadequate safety parameters validation -- missing the check of a gap as the buffer zone between crOpening and crLiquidation,,Unsatisfactory,,33
validation-166,"The updateConfig about the `crLiquidation` is currently using a risky design, but there is a safer design for it",,Unsatisfactory,,37
validation-167,Debt repayment and collateral loss risk if Size contract is paused,Acceptable risk but should be noted regardless,Satisfactory,https://github.com/code-423n4/2024-06-size/blob/main/src/libraries/RiskLibrary.sol#L104-L115,30
validation-18,Inconsistent Intermediate Asset Check in PriceFeed Constructor Leading to Incorrect Price Calculations,,Unsatisfactory,,122
validation-180,Missing check for `RoundID`,,Unsatisfactory,,49
validation-181,Bad stale borrowRate check could lead to borrow/lend at unexpected rate,,Unsatisfactory,,105
validation-182,Invalid `price` check,,Unsatisfactory,,40
validation-183,In `getAdjustedAPR` the APR will not be adjusted and it will revert,,Unsatisfactory,,63
validation-184,Lack of Loan Status Check in `createCreditPosition` Function Allows Modification of Non-Active Loans,,Unsatisfactory,,22
validation-187,liquidatorReward is Incorrectly calculated: Inconsistent Units,units,Satisfactory,https://github.com/code-423n4/2024-06-size/blob/8850e25fb088898e9cf86f9be1c401ad155bea86/src/libraries/actions/Liquidate.sol#L96-L99,45
validation-189,Incorrect Validation Logic in UpdateConfig.sol,,Unsatisfactory,,27
validation-190,Liquidated user is favored instead of liquidator when calculating the debt positions assigned collateral,,Satisfactory,https://github.com/code-423n4/2024-06-size/blob/main/src/libraries/LoanLibrary.sol#L157,43
validation-191, `executeLiquidate()` liquidaterReward is totally underestimated because the computation computes `futureValue` as 6 decimals,units,Satisfactory,https://github.com/code-423n4/2024-06-size/blob/8850e25fb088898e9cf86f9be1c401ad155bea86/src/libraries/actions/Liquidate.sol#L96-L99,88
validation-192,User's collateral Can Be Infllated  With Just 1 wei,,Unsatisfactory,,98
validation-194,Mistakenly sent eth could be locked,,Unsatisfactory,,54
validation-195,Incorrect checked address in `CapsLibrary.validateVariablePoolHasEnoughLiquidity` causes critical functions to be in a DoS state,interesting,Satisfactory,https://github.com/code-423n4/2024-06-size/blob/main/src/libraries/CapsLibrary.sol#L67-L72,98
validation-196,"Size uses wrong source to query available liquidity on Aave, resulting in borrow and lend operations being bricked upon mainnet deployment",interesting,Satisfactory,https://github.com/code-423n4/2024-06-size/blob/main/src/libraries/CapsLibrary.sol#L67-L72,155
validation-197,Size can overestimate liquidity on borrowing and lending actions after Aave upgrades to v3.1,variant?,Unsatisfactory,,75
validation-198,Deposit of ETH and USDC will not work together in multicall ,,Unsatisfactory,,60
validation-201,Borrower should always get liquidated from the smaller debt position. ,,Unsatisfactory,,33
validation-203,The method of calculate liquidator reward is incorrect,units,Satisfactory,https://github.com/code-423n4/2024-06-size/blob/8850e25fb088898e9cf86f9be1c401ad155bea86/src/libraries/actions/Liquidate.sol#L96-L99,98
validation-208,"Bad amount validation could lead to DoS, when `buyCreditMarket` called",,Unsatisfactory,,109
validation-212,No incentives to write off bad debt when remaining collateral is very small,"QA, small loan profitability liquidation",Satisfactory,https://github.com/code-423n4/2024-06-size/blob/8850e25fb088898e9cf86f9be1c401ad155bea86/src/libraries/actions/Liquidate.sol#L96-L100,19
validation-213,Errors in the calculation of the liquidator's reward result in the protocol not being able to correctly allocate the liquidation reward,units,Satisfactory,https://github.com/code-423n4/2024-06-size/blob/8850e25fb088898e9cf86f9be1c401ad155bea86/src/libraries/actions/Liquidate.sol#L96-L99,253
validation-214,"Bad amount validation could lead to DoS, when `sellCreditMarket` called",incorrect restriction,Satisfactory,"https://github.com/code-423n4/2024-06-size/blob/8850e25fb088898e9cf86f9be1c401ad155bea86/src/libraries/actions/BuyCreditMarket.sol#L91-L93,https://github.com/code-423n4/2024-06-size/blob/8850e25fb088898e9cf86f9be1c401ad155bea86/src/libraries/actions/SellCreditMarket.sol#L93-L95",42
validation-215,Overdue positions that are well collateralized will suffer greater losses than expected,,Satisfactory,https://github.com/code-423n4/2024-06-size/blob/8850e25fb088898e9cf86f9be1c401ad155bea86/src/libraries/actions/Liquidate.sol#L105-L108,88
validation-218,A lender can lose borrowAmount when another lender buys his creditpositionid,,Unsatisfactory,,39
validation-219,Lack of Penalty Fees for Overdue Repayments Leads to Increased Liquidations and Financial Risks,,Unsatisfactory,,184
validation-22,"The validation in `validateMinimumCredit` function is incorrect, which will result in  the credit amount after reduced below the minimum credit",,Unsatisfactory,,57
validation-220,No storage gaps in `Size.sol`,,Unsatisfactory,,22
validation-221,Users will not be able to withdraw their USDC in some cases,,Unsatisfactory,,75
validation-222,Liquidators are unfairly robbed of their liquidation reward,units,Satisfactory,https://github.com/code-423n4/2024-06-size/blob/8850e25fb088898e9cf86f9be1c401ad155bea86/src/libraries/actions/Liquidate.sol#L96-L99,35
validation-223,Borrowers can frontrun lenders to decrease apr and lenders can frontrun borrowers to increase apr.,,Unsatisfactory,,44
validation-226,`liquidateWithReplacement` can be DoS by the borrower,,Unsatisfactory,,68
validation-227,Attackers can frontrun forSale - false  and  allCreditPositionsForSaleDisabled - true  for a creditpositonid and buy the creditpositionid.,,Unsatisfactory,,30
validation-228,There is a missing check when compensating of a credit position.,Forceful for sale,Satisfactory,https://github.com/code-423n4/2024-06-size/blob/main/src/libraries/AccountingLibrary.sol#L118-L119,35
validation-229,"Liquidator would never see intended profit from liquidations, due to bad liquidatorReward calculation",units,Satisfactory,https://github.com/code-423n4/2024-06-size/blob/8850e25fb088898e9cf86f9be1c401ad155bea86/src/libraries/actions/Liquidate.sol#L96-L99,98
validation-230,"YieldCurve accepts negative apr inputs, which can lead to sell/buyCreditLimit orders being able to get listed but possibly never gonna get fulfilled",,Unsatisfactory,,71
validation-231,`executeSellCreditMarket` function allows transfer of credit positions to blacklisted addresses,,Unsatisfactory,,382
validation-232,Incorrect fee calculation in `AccountingLibrary.getCreditAmountIn` causing the protocol to receive a lower swap fee,"QA at most, fees",Satisfactory,"https://github.com/code-423n4/2024-06-size/blob/8850e25fb088898e9cf86f9be1c401ad155bea86/src/libraries/AccountingLibrary.sol#L249,https://github.com/code-423n4/2024-06-size/blob/8850e25fb088898e9cf86f9be1c401ad155bea86/src/libraries/AccountingLibrary.sol#L256",215
validation-233,The variablePoolBorrowRateStaleRateInterval is lack of zero check which can lead to DOS,,Unsatisfactory,,65
validation-234,The ChainLink Oracle in `PriceFeed.sol` could return the wrong price since there are no min/max Circuit breaker checks. breaker checks,,Unsatisfactory,,28
validation-237,Repay and liquidate are pausable but no grace period applied to liquidations after protocol gets unpaused which would lead to unfair liquidations of users,Acceptable risk but should be noted regardless,Satisfactory,https://github.com/code-423n4/2024-06-size/blob/main/src/libraries/RiskLibrary.sol#L104-L115,48
validation-238,Inability to perform partial liquidations allows huge positions to accrue bad debt in the system,,Unsatisfactory,,93
validation-239,`Deposit#executeDeposit()` expects msg.value but is not marked as payable,,Unsatisfactory,,84
validation-24,`multicall `Function Fails to Reset `isMulticall` Flag on Delegatecall Failure,,Unsatisfactory,,107
validation-240,Chainlink addresses/intervals should not be immutable,,Unsatisfactory,,59
validation-241,Grace period time is too much for after the sequencer comes back up and allows for accumulation of bad debt,,Unsatisfactory,,60
validation-242,Users can front/backrun the updates to the variable rates and still have a relatively lower position for their borrows on the yield curve,,Unsatisfactory,,54
validation-243,No slippage checks when withdrawing tokens from the variable pool,,Unsatisfactory,,66
validation-245,sellCreditMarket only checks openingLimitBorrowCR when opening a new position,,Unsatisfactory,,94
validation-246,"Early repay may be front ran, by MEV for profit",,Unsatisfactory,,199
validation-247,Bad tenor validation could lead to buy/sell position's credits at tenor below the limit,,Unsatisfactory,,143
validation-248,The validateUserIsNotBelowOpeningLimitBorrowCR in withdraw can lead to DOS,,Unsatisfactory,,129
validation-249,AToken cap can be violated/bypassed through multicall,total supply,Satisfactory,"https://github.com/code-423n4/2024-06-size/blob/8850e25fb088898e9cf86f9be1c401ad155bea86/src/libraries/Multicall.sol#L29,https://github.com/code-423n4/2024-06-size/blob/8850e25fb088898e9cf86f9be1c401ad155bea86/src/libraries/Multicall.sol#L37",94
validation-25,"Gas Optimization, Code Readability and Documentation, Security Enhancements, Library Use, Explicit Visibility, Function Modifiers",,Unsatisfactory,,54
validation-250,The user can claim even if the leftover credit is lower than the minimumCreditBorrowAToken.,,Unsatisfactory,,114
validation-251,Lack of Slippage Protection in Limit Orders Allows for Unfavorable Deals via MEV,,Unsatisfactory,,51
validation-252,inconsistency in variable pool liquidity validation,fee 2 getCreditAmountIn ,Satisfactory,"https://github.com/code-423n4/2024-06-size/blob/8850e25fb088898e9cf86f9be1c401ad155bea86/src/libraries/AccountingLibrary.sol#L197,https://github.com/code-423n4/2024-06-size/blob/8850e25fb088898e9cf86f9be1c401ad155bea86/src/libraries/AccountingLibrary.sol#L207",54
validation-255,Malicious borrower can prevent liquidations,,Unsatisfactory,,72
validation-257,Liquidator rewards are inflated.,units,Satisfactory,https://github.com/code-423n4/2024-06-size/blob/8850e25fb088898e9cf86f9be1c401ad155bea86/src/libraries/actions/Liquidate.sol#L96-L99,127
validation-258,Legitimate call with small cash out can be reverted.,incorrect restriction,Satisfactory,"https://github.com/code-423n4/2024-06-size/blob/8850e25fb088898e9cf86f9be1c401ad155bea86/src/libraries/actions/BuyCreditMarket.sol#L91-L93,https://github.com/code-423n4/2024-06-size/blob/8850e25fb088898e9cf86f9be1c401ad155bea86/src/libraries/actions/SellCreditMarket.sol#L93-L95",170
validation-262,"During liquidation, the higher the collateral ratio is, the more the loss of borrower is. ",,Satisfactory,https://github.com/code-423n4/2024-06-size/blob/8850e25fb088898e9cf86f9be1c401ad155bea86/src/libraries/actions/Liquidate.sol#L105-L108,99
validation-263,Lenders calling buyCreditMarket can be front-run by borrowers due to lack of Non-Zero check on minAPR,,Unsatisfactory,,159
validation-264,"Protocol Doesn't Implement Extra Reward Claiming from Aave, leading to a loss of yield",,Unsatisfactory,,31
validation-265,Validation logic in `validateVariablePoolHasEnoughLiquidity()` is inaccurate with the introduction of virtual Accounting in AAVE3.1,,Unsatisfactory,,50
validation-266,Min/max answers from the chainlink aggregators are not checked,,Unsatisfactory,,112
validation-267,Borrower has no control over max loan amount,,Unsatisfactory,,81
validation-268,`CapsLibrary.sol#validateBorrowATokenIncreaseLteDebtTokenDecrease` uses wrong source of `borrowAToken` total supply rendering validation ineffective which allows anyone to bypass cap limit by deposit via `multicall`,"QA, multicall",Satisfactory,https://github.com/code-423n4/2024-06-size/blob/main/src/libraries/CapsLibrary.sol#L19-L44,206
validation-269,[M-1] `Deposit::executeDeposit` uses `address(this).balance` which can lead to unintended financial operations,,Unsatisfactory,,64
validation-27,Reentrancy Vulnerability in multicall Function,,Unsatisfactory,,20
validation-270,[M-2] Missing Validation for `crOpening` and `crLiquidation` in `UpdateConfig::executeUpdateConfig` could lead to risky parameters,,Unsatisfactory,,50
validation-271,Missing check on loan repayment resulting in free credits,,Unsatisfactory,,56
validation-272,Incorrect computation of liquidator's reward,units,Satisfactory,https://github.com/code-423n4/2024-06-size/blob/8850e25fb088898e9cf86f9be1c401ad155bea86/src/libraries/actions/Liquidate.sol#L96-L99,76
validation-278,Executing nested `Multicall::multicall` functions as calldata to `Multicall::multicall` can lead to state inconsistencies and increase the risk of reentrancy attacks.,,Unsatisfactory,,48
validation-280,borrowATokenCap can be bypassed through multicall(),"QA, multicall",Satisfactory,https://github.com/code-423n4/2024-06-size/blob/main/src/libraries/CapsLibrary.sol#L19-L44,91
validation-281,"When liquidateWithReplacement is called, the new borrower does not pay the swapFee ",no fee on replacement,Satisfactory,https://github.com/code-423n4/2024-06-size/blob/8850e25fb088898e9cf86f9be1c401ad155bea86/src/libraries/actions/LiquidateWithReplacement.sol#L146,93
validation-282,The use of `block.timestamp` in calculating tenors and deadlines can lead to MEV exploitation,,Unsatisfactory,,97
validation-284,"protocol blocks partial repayment, even though they improve borrowers health in certain conditions",,Unsatisfactory,,52
validation-287,Insufficient check when updating crOpening,,Unsatisfactory,,69
validation-288,No mechanism to protect `DebtPositions` that become overdue during Protocol Pause from liquidations,Acceptable risk but should be noted regardless,Satisfactory,https://github.com/code-423n4/2024-06-size/blob/main/src/libraries/RiskLibrary.sol#L104-L115,33
validation-289,It's possible to swap credit without payng fees ,"QA at most, fees",Satisfactory,"https://github.com/code-423n4/2024-06-size/blob/8850e25fb088898e9cf86f9be1c401ad155bea86/src/libraries/AccountingLibrary.sol#L249,https://github.com/code-423n4/2024-06-size/blob/8850e25fb088898e9cf86f9be1c401ad155bea86/src/libraries/AccountingLibrary.sol#L256",102
validation-290,Insufficient validation of `maxDueDate` presents a risk for lenders allowing unintended 0% APR loans ,,Satisfactory,https://github.com/code-423n4/2024-06-size/blob/8850e25fb088898e9cf86f9be1c401ad155bea86/src/libraries/actions/BuyCreditLimit.sol#L42,75
validation-291,Fragmentation fee is not applied during compensate if minting new credit.,no frag fee,Satisfactory,"https://github.com/code-423n4/2024-06-size/blob/main/src/libraries/actions/Compensate.sol#L136,https://github.com/code-423n4/2024-06-size/blob/main/src/libraries/actions/Compensate.sol#L146",107
validation-292,Borrower can set openingLimitBorrowCR to max to make BuyCreditMarket order always revert,,Unsatisfactory,,84
validation-294,Borrower Gets Immediately Liquidated After Repayments Resume,Acceptable risk but should be noted regardless,Satisfactory,https://github.com/code-423n4/2024-06-size/blob/main/src/libraries/RiskLibrary.sol#L104-L115,186
validation-295,Arbitrary `from` passed to `transferFrom` (or `safeTransferFrom`) in DepositTokenLibrary.sol,,Unsatisfactory,,53
validation-296,depositing native eth and usdc in the same multicall will always revert,,Unsatisfactory,,131
validation-297,Incorrect fee calculation in sellCreditMarket,"QA at most, fees",Satisfactory,"https://github.com/code-423n4/2024-06-size/blob/8850e25fb088898e9cf86f9be1c401ad155bea86/src/libraries/AccountingLibrary.sol#L249,https://github.com/code-423n4/2024-06-size/blob/8850e25fb088898e9cf86f9be1c401ad155bea86/src/libraries/AccountingLibrary.sol#L256",149
validation-30,Fixed hearbeat used for price validation is too stale for some tokens,,Unsatisfactory,,76
validation-303,Inadequate checks to confirm the correct status of the sequecnce/sequecncerUptimeFeed in `PriceFeed.getPrice()` contract. ,interesting chainlink,Satisfactory,https://github.com/code-423n4/2024-06-size/blob/8850e25fb088898e9cf86f9be1c401ad155bea86/src/oracle/PriceFeed.sol#L73,64
validation-305,Incorrect calculation of swapFees in `getCreditAmountIn` function,"QA at most, fees",Satisfactory,"https://github.com/code-423n4/2024-06-size/blob/8850e25fb088898e9cf86f9be1c401ad155bea86/src/libraries/AccountingLibrary.sol#L249,https://github.com/code-423n4/2024-06-size/blob/8850e25fb088898e9cf86f9be1c401ad155bea86/src/libraries/AccountingLibrary.sol#L256",467
validation-306,DoS in BuyCreditMarket() due to incorrect configuration of minimumCreditBorrowAToken,,Unsatisfactory,,87
validation-307,Multicall Failure Due to Concurrent Collateral and Borrow Token Deposits in `Size::deposit(),,Unsatisfactory,,65
validation-308,Users can end up with unwanted debt,exit?,Abstain,,32
validation-309, Users Can Bypass `borrowATokenCap` Check Through `multicall` Due to Incorrect Validation,"QA, multicall",Satisfactory,https://github.com/code-423n4/2024-06-size/blob/main/src/libraries/CapsLibrary.sol#L19-L44,146
validation-31,`latestRoundData()` Call May Result Stale,,Unsatisfactory,,37
validation-313,Lack of maxDueDate in borrow offers/limit-orders,,Unsatisfactory,,66
validation-314,Solidity version >= 0.8.20 will not work on Base due to PUSH0,,Unsatisfactory,,28
validation-315,Full liquidations of debt positions risks putting the protocol in bad debt,,Unsatisfactory,,49
validation-316,Liquidation reward is calculated incorrectly and will always be very low which presents no incentive for liquidators to liquidate underwater/overdue positions,units,Satisfactory,https://github.com/code-423n4/2024-06-size/blob/8850e25fb088898e9cf86f9be1c401ad155bea86/src/libraries/actions/Liquidate.sol#L96-L99,128
validation-317,Liquidator minimum profit check can fail when liquidator fails to provide sufficient input,,Unsatisfactory,,65
validation-318,fragmentationFee in compensate is not implemented correctly,no frag fee,Satisfactory,"https://github.com/code-423n4/2024-06-size/blob/main/src/libraries/actions/Compensate.sol#L136,https://github.com/code-423n4/2024-06-size/blob/main/src/libraries/actions/Compensate.sol#L146",70
validation-319,Unexpected reverts or no incentives during liquidation due to wrong liquidatorReward calculation.,units,Satisfactory,https://github.com/code-423n4/2024-06-size/blob/8850e25fb088898e9cf86f9be1c401ad155bea86/src/libraries/actions/Liquidate.sol#L96-L99,86
