issue,title,validator comment,grade,root cause (URL),size
validation-320,Users could abuse `compensate()` to fragment creditPositions without paying any fragementation fee,no frag fee,Satisfactory,"https://github.com/code-423n4/2024-06-size/blob/main/src/libraries/actions/Compensate.sol#L136,https://github.com/code-423n4/2024-06-size/blob/main/src/libraries/actions/Compensate.sol#L146",119
validation-321,Lack of slippage control on minimum Borrow amount received can create undesirable debt positions for borrowers ,,Unsatisfactory,,69
validation-322,The `borrowAtoken` supply checks in `multicall()` are completely wrong,"QA, multicall",Satisfactory,https://github.com/code-423n4/2024-06-size/blob/main/src/libraries/CapsLibrary.sol#L19-L44,99
validation-323,Incorrect liquidator reward calculation results in significant loss of reward,units,Satisfactory,https://github.com/code-423n4/2024-06-size/blob/8850e25fb088898e9cf86f9be1c401ad155bea86/src/libraries/actions/Liquidate.sol#L96-L99,94
validation-324,Incorrect Reward Calculation in `executeLiquidate`,units,Satisfactory,https://github.com/code-423n4/2024-06-size/blob/8850e25fb088898e9cf86f9be1c401ad155bea86/src/libraries/actions/Liquidate.sol#L96-L99,145
validation-325,Borrower overpays interest due to incorrect inclusion of fragmentation fee in credit calculation,fee 2 getCreditAmountIn ,Satisfactory,"https://github.com/code-423n4/2024-06-size/blob/8850e25fb088898e9cf86f9be1c401ad155bea86/src/libraries/AccountingLibrary.sol#L197,https://github.com/code-423n4/2024-06-size/blob/8850e25fb088898e9cf86f9be1c401ad155bea86/src/libraries/AccountingLibrary.sol#L207",58
validation-326,Hardcoding aave pool address is a serious aave integration flaw because valid pool addresses can change.,,Unsatisfactory,,88
validation-327,Incorrect swap fee calculation in SellCreditMarket leads to protocol receiving less than they should,"QA at most, fees",Satisfactory,"https://github.com/code-423n4/2024-06-size/blob/8850e25fb088898e9cf86f9be1c401ad155bea86/src/libraries/AccountingLibrary.sol#L249,https://github.com/code-423n4/2024-06-size/blob/8850e25fb088898e9cf86f9be1c401ad155bea86/src/libraries/AccountingLibrary.sol#L256",188
validation-328,Loans are undervalued in `buyCreditMarket()` due to wrong rounding,"QA at most, fees",Satisfactory,"https://github.com/code-423n4/2024-06-size/blob/8850e25fb088898e9cf86f9be1c401ad155bea86/src/libraries/AccountingLibrary.sol#L249,https://github.com/code-423n4/2024-06-size/blob/8850e25fb088898e9cf86f9be1c401ad155bea86/src/libraries/AccountingLibrary.sol#L256",85
validation-329,Borrowers do not pay any swap fees during liquidation with replacement,no fee on replacement,Satisfactory,https://github.com/code-423n4/2024-06-size/blob/8850e25fb088898e9cf86f9be1c401ad155bea86/src/libraries/actions/LiquidateWithReplacement.sol#L146,42
validation-330,"Absense of a minCredit amount in limit orders, could expose users to unfavourable or unprofitable matches",,Unsatisfactory,,43
validation-331,User funds could get stuck or unexpected reverts could occur,fee 2 getCreditAmountIn ,Satisfactory,"https://github.com/code-423n4/2024-06-size/blob/8850e25fb088898e9cf86f9be1c401ad155bea86/src/libraries/AccountingLibrary.sol#L197,https://github.com/code-423n4/2024-06-size/blob/8850e25fb088898e9cf86f9be1c401ad155bea86/src/libraries/AccountingLibrary.sol#L207",49
validation-332,LiquidatorReward is not properly calculated,units,Satisfactory,https://github.com/code-423n4/2024-06-size/blob/8850e25fb088898e9cf86f9be1c401ad155bea86/src/libraries/actions/Liquidate.sol#L96-L99,54
validation-333,Malicious user can DoS other users' deposits,,Unsatisfactory,,85
validation-334,Borrow token supply cap can be bypassed using multicall,total supply,Satisfactory,"https://github.com/code-423n4/2024-06-size/blob/8850e25fb088898e9cf86f9be1c401ad155bea86/src/libraries/Multicall.sol#L29,https://github.com/code-423n4/2024-06-size/blob/8850e25fb088898e9cf86f9be1c401ad155bea86/src/libraries/Multicall.sol#L37",67
validation-335, Unbounded return data in external calls of `DepositTokenLibrary.sol` of can lead to excessive gas consumption and DoS,,Unsatisfactory,,257
validation-336,"During profitable liquidations, under certain conditions the fee for the protocol can be 0",,Unsatisfactory,,83
validation-337,Size overcharges lender and overpays borrower during `sellCreditMarket` calls,,Unsatisfactory,,203
validation-339,Charging more Credit than what it should be really charged to CreditSellers when Selling Credit with a market order for a specific amount of cash.,"QA at most, fees",Satisfactory,"https://github.com/code-423n4/2024-06-size/blob/8850e25fb088898e9cf86f9be1c401ad155bea86/src/libraries/AccountingLibrary.sol#L249,https://github.com/code-423n4/2024-06-size/blob/8850e25fb088898e9cf86f9be1c401ad155bea86/src/libraries/AccountingLibrary.sol#L256",232
validation-34,State Inconsistency Due to Unhandled Revert in `multicall` Function,,Unsatisfactory,,54
validation-340,Borrowers can fragmentate credit without paying the fragmentationFee when partially repaying a DebtPosition via Compensate,no frag fee,Satisfactory,"https://github.com/code-423n4/2024-06-size/blob/main/src/libraries/actions/Compensate.sol#L136,https://github.com/code-423n4/2024-06-size/blob/main/src/libraries/actions/Compensate.sol#L146",122
validation-341,Rounding on profitable liquidations beneffits the Liquidator at the expense of the Borrower and the Protocol,,Unsatisfactory,,91
validation-342,"SellingCredit can incorrectly reverts because `params.amount` is incorrectly threated as if it would represent `credit`, when in reality could represent `cash` and the credit been sold would be grather than minimumCreditBorrowAToken",incorrect restriction,Satisfactory,"https://github.com/code-423n4/2024-06-size/blob/8850e25fb088898e9cf86f9be1c401ad155bea86/src/libraries/actions/BuyCreditMarket.sol#L91-L93,https://github.com/code-423n4/2024-06-size/blob/8850e25fb088898e9cf86f9be1c401ad155bea86/src/libraries/actions/SellCreditMarket.sol#L93-L95",53
validation-343,Price feed contract does not check for minAnswer and maxAnswer,,Unsatisfactory,,41
validation-344,Incorrect validation to determine if the liquidator receives the requested minimum profit for executing the validation.,,Unsatisfactory,,91
validation-345,CreditSellers are not charged the swapFee for receiving cash when their SellCredit LimitOrders are filled by a liquidation with replacement,no fee on replacement,Satisfactory,https://github.com/code-423n4/2024-06-size/blob/8850e25fb088898e9cf86f9be1c401ad155bea86/src/libraries/actions/LiquidateWithReplacement.sol#L146,57
validation-346,Users can scam other users when they match their loan ,,Unsatisfactory,,116
validation-347,Liquidator's reward are wrongly computed because they are not converted to its value worth in collateral.,units,Satisfactory,https://github.com/code-423n4/2024-06-size/blob/8850e25fb088898e9cf86f9be1c401ad155bea86/src/libraries/actions/Liquidate.sol#L96-L99,89
validation-348,Rounding down when computing issuanceValue causes the new borrower to get less cash than what it would get for the same amount of Credit if his borrow offer would have been filled with a BuyCredit MarketOrder.,,Unsatisfactory,,111
validation-349,CreditBuyers can bring down the CollateralRatio of CreditSellers by generating new loans instead of buying credit from an existing position the CreditSellers put on sale.,exit?,Abstain,,27
validation-35,Missing check in `validateMinimumCreditOpening` function,,Unsatisfactory,,31
validation-350,Wrong `liquidatorReward` in a profitable liquidation.,units,Satisfactory,https://github.com/code-423n4/2024-06-size/blob/8850e25fb088898e9cf86f9be1c401ad155bea86/src/libraries/actions/Liquidate.sol#L96-L99,80
validation-351,When a creditPosition is transferred to a new lender when calling `compensate` it is not ensured that the creditPosition is forSale,Forceful for sale,Satisfactory,https://github.com/code-423n4/2024-06-size/blob/main/src/libraries/AccountingLibrary.sol#L118-L119,56
validation-352,"In `validateCompensate` there is wrong check that can approve transaction that will make right users not able to compensate, some borrowers to exploit protocol or some lenders not to claim their credit at expected due date",,Unsatisfactory,,68
validation-353,Borrowers pay more credit than necessary due to incorrect calculations,"QA at most, fees",Satisfactory,"https://github.com/code-423n4/2024-06-size/blob/8850e25fb088898e9cf86f9be1c401ad155bea86/src/libraries/AccountingLibrary.sol#L249,https://github.com/code-423n4/2024-06-size/blob/8850e25fb088898e9cf86f9be1c401ad155bea86/src/libraries/AccountingLibrary.sol#L256",120
validation-354,Borrowers can DoS Lenders from Selling Credit from their Existing CreditPositions by compensating the CreditPosition been sold,,Unsatisfactory,,91
validation-355,Input validation of [repayAmount] in [repayDebt] function,,Unsatisfactory,,43
validation-356,Non-functional Borrowing Mechanism Leads to Debt Accrual Without Fund Transfer,,Unsatisfactory,,304
validation-357,credit positions marked not for sale can be sold. ,,Unsatisfactory,,91
validation-358,Current liquidation mechanism can cause borrowers with multiple debt positions to lose collateral more than they should,,Unsatisfactory,,198
validation-359,Lenders can be front-runned while disabling forSale flag for a credit position,intended,Unsatisfactory,,70
validation-360,Size performs insufficient available liquidity check during `liquidateWithReplacement` calls,,Unsatisfactory,,140
validation-361,Minimum credit check can lead to sell credit market dos,,Unsatisfactory,,70
validation-362,Reentrancy Attack is possible.,,Unsatisfactory,,45
validation-363,Incorrect Minimum credit Check in `validateBuyCreditMarket`,incorrect restriction,Satisfactory,"https://github.com/code-423n4/2024-06-size/blob/8850e25fb088898e9cf86f9be1c401ad155bea86/src/libraries/actions/BuyCreditMarket.sol#L91-L93,https://github.com/code-423n4/2024-06-size/blob/8850e25fb088898e9cf86f9be1c401ad155bea86/src/libraries/actions/SellCreditMarket.sol#L93-L95",58
validation-364,"Protocol pausing during market volatility can prevent lenders from self-liquidating debt, potentially leading to significant financial losses.",Acceptable risk but should be noted regardless,Satisfactory,https://github.com/code-423n4/2024-06-size/blob/main/src/libraries/RiskLibrary.sol#L104-L115,44
validation-365,"The Liquidate::liquidatorProfitCollateralToken function currently over-rewards liquidators due to combining collateral and borrow tokens, resulting in consistently high liquidator reward.",units,Satisfactory,https://github.com/code-423n4/2024-06-size/blob/8850e25fb088898e9cf86f9be1c401ad155bea86/src/libraries/actions/Liquidate.sol#L96-L99,70
validation-367,Deposits of underlying borrow token via multicall can go above the cap,total supply,Satisfactory,"https://github.com/code-423n4/2024-06-size/blob/8850e25fb088898e9cf86f9be1c401ad155bea86/src/libraries/Multicall.sol#L29,https://github.com/code-423n4/2024-06-size/blob/8850e25fb088898e9cf86f9be1c401ad155bea86/src/libraries/Multicall.sol#L37",97
validation-368,"The `validateVariablePoolHasEnoughLiquidity()` check can be bypassed, giving certain users an unfair advantage",QA,Satisfactory,https://github.com/code-423n4/2024-06-size/blob/main/src/libraries/CapsLibrary.sol#L19-L44,101
validation-369,Ability to change the apr of the curve any time allow lenders and borrower to front run the actions.,,Unsatisfactory,,63
validation-37,The total supply of borrowAToken can go over the specified cap,total supply,Satisfactory,"https://github.com/code-423n4/2024-06-size/blob/8850e25fb088898e9cf86f9be1c401ad155bea86/src/libraries/Multicall.sol#L29,https://github.com/code-423n4/2024-06-size/blob/8850e25fb088898e9cf86f9be1c401ad155bea86/src/libraries/Multicall.sol#L37",118
validation-370,"The `BuyCreditLimit::validateBuyCreditLimit` method incorrectly uses `minTenor` instead of `maxTenor`, potentially allowing `LoanOffer` creation that exceeds the maximum due date.",,Unsatisfactory,,40
validation-371,Users may incur an unexpected fragmentation fee in the `compensate()`  call,,Unsatisfactory,,129
validation-373,Centralization Risk in Role Management,,Unsatisfactory,,45
validation-374,Report on `CreateInitCodeSizeLimit` Issue and Potential Optimizations for the Size Protocol,,Unsatisfactory,,170
validation-375,Lender always can DoS a Lender trying to exit credit early.,,Satisfactory,https://github.com/code-423n4/2024-06-size/blob/8850e25fb088898e9cf86f9be1c401ad155bea86/src/libraries/actions/Compensate.sol#L139-L145,106
validation-377,Protocol fails to take fragmentation fee during credit fractionalization for every compensate call with params.creditPositionToCompensateId == RESERVED_ID.,no frag fee,Satisfactory,"https://github.com/code-423n4/2024-06-size/blob/main/src/libraries/actions/Compensate.sol#L136,https://github.com/code-423n4/2024-06-size/blob/main/src/libraries/actions/Compensate.sol#L146",232
validation-378,Compensations can be used to artificially make a position overdue and avoid a larger protocol fee during liquidations under certain conditions,compensation delay of liquidation,Satisfactory,https://github.com/code-423n4/2024-06-size/blob/8850e25fb088898e9cf86f9be1c401ad155bea86/src/libraries/actions/Compensate.sol#L75-L82,203
validation-38,"Borrowers can partially pay back and leave a small borrowing amount in their position, leading to the protocol's bad debt","QA, small loan profitability liquidation",Satisfactory,https://github.com/code-423n4/2024-06-size/blob/8850e25fb088898e9cf86f9be1c401ad155bea86/src/libraries/actions/Liquidate.sol#L96-L100,52
validation-380,"Compensate can be used to dump ""unwanted"" positions on unsuspecting lenders",appears to be QA,Satisfactory,https://github.com/code-423n4/2024-06-size/blob/8850e25fb088898e9cf86f9be1c401ad155bea86/src/libraries/RiskLibrary.sol#L95,98
validation-383,Unchecked External Call in Multicall Function,,Unsatisfactory,,49
validation-384,No storage gap for upgradeable contracts,,Unsatisfactory,,43
validation-385,"The `validateBorrowATokenCap()` restriction in `deposit()` can be easily bypassed by wrapping it in a `multicall()` call, giving certain users an unfair advantage","QA, multicall",Satisfactory,https://github.com/code-423n4/2024-06-size/blob/main/src/libraries/CapsLibrary.sol#L19-L44,94
validation-388,Users cant withdraw borrowATokens if they are under the opening collateral limit,,Unsatisfactory,,45
validation-389,Malicious actors can do block stuffing and liquidate a debt to profit when repayment is close to the dueDate timestamp.,,Unsatisfactory,,25
validation-39,SizeStorage:Corruptible Upgradability Pattern in State structs,,Unsatisfactory,,55
validation-390,borrower that get matched through `liquidateWithReplacement()` will unfairly get more Cash than he should.,no fee on replacement,Satisfactory,https://github.com/code-423n4/2024-06-size/blob/8850e25fb088898e9cf86f9be1c401ad155bea86/src/libraries/actions/LiquidateWithReplacement.sol#L146,73
validation-391,Liquidator reward is incorrectly calculated during liquidation,units,Satisfactory,https://github.com/code-423n4/2024-06-size/blob/8850e25fb088898e9cf86f9be1c401ad155bea86/src/libraries/actions/Liquidate.sol#L96-L99,116
validation-392,Fragmentation fee can be avoided during debt compensation,no frag fee,Satisfactory,"https://github.com/code-423n4/2024-06-size/blob/main/src/libraries/actions/Compensate.sol#L136,https://github.com/code-423n4/2024-06-size/blob/main/src/libraries/actions/Compensate.sol#L146",223
validation-393,Borrow offer can be used more than once to significantly decrease borrower collateral ratio,,Unsatisfactory,,57
validation-394,manipulate rates of aave based rates,,Unsatisfactory,,17
validation-395,Insufficient validation of an Oracle data feed,,Unsatisfactory,,50
validation-396,"`Deposit` function allows blacklisted addresses to receive tokens and open positions, bypassing underlying token restrictions",,Unsatisfactory,,331
validation-40,Incorrect Liquidation Logic Leading to Potential Financial Discrepancies and Unauthorized Access,,Unsatisfactory,,224
validation-403,Creation of valid loans will revert due to comparing a cash value with credit one,incorrect restriction,Satisfactory,"https://github.com/code-423n4/2024-06-size/blob/8850e25fb088898e9cf86f9be1c401ad155bea86/src/libraries/actions/BuyCreditMarket.sol#L91-L93,https://github.com/code-423n4/2024-06-size/blob/8850e25fb088898e9cf86f9be1c401ad155bea86/src/libraries/actions/SellCreditMarket.sol#L93-L95",245
validation-404,Protocol swap fees accidentally sent to lender instead of the protocol due to wrong fees calculation in SellCreditMarket.,"QA at most, fees",Satisfactory,"https://github.com/code-423n4/2024-06-size/blob/8850e25fb088898e9cf86f9be1c401ad155bea86/src/libraries/AccountingLibrary.sol#L249,https://github.com/code-423n4/2024-06-size/blob/8850e25fb088898e9cf86f9be1c401ad155bea86/src/libraries/AccountingLibrary.sol#L256",187
validation-405,Lenders might capitalize on more borrow token that they're entitled to during significant liquidity index changes,,Unsatisfactory,,57
validation-406,Users can skip the fragmentation fee through the `compensate()` action,no frag fee,Satisfactory,"https://github.com/code-423n4/2024-06-size/blob/main/src/libraries/actions/Compensate.sol#L136,https://github.com/code-423n4/2024-06-size/blob/main/src/libraries/actions/Compensate.sol#L146",157
validation-407,Normal `Liquidate` action incentives are too low due to decimals misshandling,units,Satisfactory,https://github.com/code-423n4/2024-06-size/blob/8850e25fb088898e9cf86f9be1c401ad155bea86/src/libraries/actions/Liquidate.sol#L96-L99,77
validation-408,Arbitrary `from` passed to `transferFrom` (or `safeTransferFrom`) in Liquidate.sol,,Unsatisfactory,,43
validation-409,There's no liquidation incentive for small positions which can lead to the accrual of bad debt,"QA, small loan profitability liquidation",Satisfactory,https://github.com/code-423n4/2024-06-size/blob/8850e25fb088898e9cf86f9be1c401ad155bea86/src/libraries/actions/Liquidate.sol#L96-L100,39
validation-411,Findings Report for Self-Liquidation Vulnerability in SelfLiquidate.sol,,Unsatisfactory,,36
validation-412,Liquidator reward is not calculated correctly,units,Satisfactory,https://github.com/code-423n4/2024-06-size/blob/8850e25fb088898e9cf86f9be1c401ad155bea86/src/libraries/actions/Liquidate.sol#L96-L99,114
validation-413,Credit seller(lender early exit) could be instead made to borrow unexpectedly due to offer being the same as borrower's offer.,,Unsatisfactory,,91
validation-414,Incorrect cashAmount check for variable pool ability to fulfill withdrawal,,Satisfactory,https://github.com/code-423n4/2024-06-size/blob/8850e25fb088898e9cf86f9be1c401ad155bea86/src/Size.sol#L184,68
validation-416,incorrect check for cash against credit makes check redundant,,Unsatisfactory,,35
validation-419,Liquidator cannot achieve proper liquidator reward as protocol promised,units,Satisfactory,https://github.com/code-423n4/2024-06-size/blob/8850e25fb088898e9cf86f9be1c401ad155bea86/src/libraries/actions/Liquidate.sol#L96-L99,62
validation-42,Liquidators will never profit from liquidations,units,Satisfactory,https://github.com/code-423n4/2024-06-size/blob/8850e25fb088898e9cf86f9be1c401ad155bea86/src/libraries/actions/Liquidate.sol#L96-L99,144
validation-421,Incomplete check to protect credit sellers in sellCreditMarket,,Unsatisfactory,,37
validation-423,No check that the variable pool balance is greater than the amount of cash being transferred ,,Unsatisfactory,,39
validation-424,Unauthorized Token Transfer Risk in SellCreditMarket.sol,,Unsatisfactory,,38
validation-425,legitimate selfLiquidate can be stopped by users looking to earn liquidation profit,,Unsatisfactory,,44
validation-426,Wrong calculations causes the borrowers to owe more credit than necessary,"QA at most, fees",Satisfactory,"https://github.com/code-423n4/2024-06-size/blob/8850e25fb088898e9cf86f9be1c401ad155bea86/src/libraries/AccountingLibrary.sol#L249,https://github.com/code-423n4/2024-06-size/blob/8850e25fb088898e9cf86f9be1c401ad155bea86/src/libraries/AccountingLibrary.sol#L256",130
validation-427,H-3: Inability to Withdraw ETH in Size.sol ,,Unsatisfactory,,21
validation-428,Inability to Withdraw ETH in Size.sol ,,Unsatisfactory,,54
validation-429,Loss of funds for protocol as incorrect rounding is implemented,,Unsatisfactory,,26
validation-430,Liquidator can take away protocol's earn during liquidation with replacement borrower.,,Unsatisfactory,,85
validation-431,Incorrect validation to determine liquidatorReward ,units,Satisfactory,https://github.com/code-423n4/2024-06-size/blob/8850e25fb088898e9cf86f9be1c401ad155bea86/src/libraries/actions/Liquidate.sol#L96-L99,28
validation-432,`Fees` is calculated wrongly in `AccountingLibrary.sol#getCreditAmountIn()` function.,"QA at most, fees",Satisfactory,"https://github.com/code-423n4/2024-06-size/blob/8850e25fb088898e9cf86f9be1c401ad155bea86/src/libraries/AccountingLibrary.sol#L249,https://github.com/code-423n4/2024-06-size/blob/8850e25fb088898e9cf86f9be1c401ad155bea86/src/libraries/AccountingLibrary.sol#L256",143
validation-433,Missing Return Statement in approve Function of NonTransferrableToken.sol,,Unsatisfactory,,34
validation-434,Liquidation and Self-Liquidation functions could be paused by Owner and lead to user loss of funds if their collateral value is dropping within that period ,Acceptable risk but should be noted regardless,Satisfactory,https://github.com/code-423n4/2024-06-size/blob/main/src/libraries/RiskLibrary.sol#L104-L115,21
validation-435,Centralization Risk for Trusted Owners in Size.sol,,Unsatisfactory,,71
validation-436,Centralization Risk for trusted owners in NonTransferrableScaledToken.sol,,Unsatisfactory,,57
validation-437,Centralization Risk for trusted owners in NonTransferrableToken.sol,,Unsatisfactory,,21
validation-438,Overdue loans can't be partially repaid using `compensate`,,Unsatisfactory,,98
validation-439,Users can not compensate with `creditPositionToCompensateId = RESERVED_ID` at the end of the loan,,Unsatisfactory,,51
validation-44,Wrong calculation of `fees` in `SellCreditMarket` when `params.exactAmountIn == false` and `params.creditPositionId == RESERVED_ID`,"QA at most, fees",Satisfactory,"https://github.com/code-423n4/2024-06-size/blob/8850e25fb088898e9cf86f9be1c401ad155bea86/src/libraries/AccountingLibrary.sol#L249,https://github.com/code-423n4/2024-06-size/blob/8850e25fb088898e9cf86f9be1c401ad155bea86/src/libraries/AccountingLibrary.sol#L256",117
validation-440,still possible to take loans amounts below the riskConfig.minimumCreditBorrowAToken,minimum bypass via replacement,Satisfactory,https://github.com/code-423n4/2024-06-size/blob/8850e25fb088898e9cf86f9be1c401ad155bea86/src/libraries/actions/LiquidateWithReplacement.sol#L47-L93,171
validation-441,Lenders must have valid BorrowOffer in order to sell their credit positions,,Unsatisfactory,,72
validation-442,Using `ERC721::_mint()` can be dangerous in NonTransferrableToken.sol,,Unsatisfactory,,44
validation-443,The new borrower in `LiquidateWithReplacement` is not charged swapping fee,no fee on replacement,Satisfactory,https://github.com/code-423n4/2024-06-size/blob/8850e25fb088898e9cf86f9be1c401ad155bea86/src/libraries/actions/LiquidateWithReplacement.sol#L146,47
validation-444, Using ERC721::\_mint() Can Be Dangerous in NonTransferrableToken.sol,,Unsatisfactory,,38
validation-445,Wrong calculation of `fees` in `SellCreditMarket` when `params.exactAmountIn == false` and `params.creditPositionId != RESERVED_ID`,"QA at most, fees",Satisfactory,"https://github.com/code-423n4/2024-06-size/blob/8850e25fb088898e9cf86f9be1c401ad155bea86/src/libraries/AccountingLibrary.sol#L249,https://github.com/code-423n4/2024-06-size/blob/8850e25fb088898e9cf86f9be1c401ad155bea86/src/libraries/AccountingLibrary.sol#L256",104
validation-448,Updating `crOpening` can block existing users from withdrawing,,Unsatisfactory,,59
validation-449,Wrong low and high tenors  (values in the x axis) are used to calculate the final apr,Wrong order of arguments,Satisfactory,https://github.com/code-423n4/2024-06-size/blob/8850e25fb088898e9cf86f9be1c401ad155bea86/src/libraries/Math.sol#L67,73
validation-450,Lender cannot do exactAmountIn in case of buyCreditMarketOrder and seller cannot do cashAmountOut  in case of sellCreditMarketOrder,,Unsatisfactory,,77
validation-451,Liquidator Reward is calculated wrong due to incorrect comparison- Liquidation.sol,units,Satisfactory,https://github.com/code-423n4/2024-06-size/blob/8850e25fb088898e9cf86f9be1c401ad155bea86/src/libraries/actions/Liquidate.sol#L96-L99,70
validation-452,Lender/SelfLiquidator receives less collateral from borrower than expected.,,Unsatisfactory,,71
validation-453,Borrower cannot save himself from liquidation by paying partial debt - Compensate.sol,,Unsatisfactory,,54
validation-454,Updated tenor range is not being used to validate before creating new credit-debt Position. - Buy/SellCreditMarketOrder and Compensate,,Unsatisfactory,,83
validation-455,Lender is not allowed to take calculated Risk to avoid a huge selfLiquidation Loss - Buy/SellCreditMarketOrder,,Unsatisfactory,,82
validation-456,Fragmentation Fee is not properly enforced on all credit splits during compensation,no frag fee,Satisfactory,"https://github.com/code-423n4/2024-06-size/blob/main/src/libraries/actions/Compensate.sol#L136,https://github.com/code-423n4/2024-06-size/blob/main/src/libraries/actions/Compensate.sol#L146",120
validation-457,Grief the Protocol by filling all the debtPosition and creditPosition slots available without  facing any loss to the attacker - Compensate.sol,,Unsatisfactory,,49
