issue,title,validator comment,grade,root cause (URL),size
validation-458,Volatile cap on borrowOffers can lead to borrowers incurring more debt than expected,restrained by approval?,Unsatisfactory,,63
validation-459,Liquidator will be grieved if he provides minimumCollateralProfit as 0.,,Unsatisfactory,,89
validation-46,Incorrect calculation of liquidator reward in Liquidate.sol leads to failed liquidations,units,Satisfactory,https://github.com/code-423n4/2024-06-size/blob/8850e25fb088898e9cf86f9be1c401ad155bea86/src/libraries/actions/Liquidate.sol#L96-L99,106
validation-460,MaxDueDate of the LoanOffer is not checked while an existing creditPosition is bought-  BuyCreditMarket,,Unsatisfactory,,87
validation-461,Incorrect calculation of fees lead to protocols Loss - sellCreditMarketOrder.,fee 2 getCreditAmountIn ,Satisfactory,"https://github.com/code-423n4/2024-06-size/blob/8850e25fb088898e9cf86f9be1c401ad155bea86/src/libraries/AccountingLibrary.sol#L197,https://github.com/code-423n4/2024-06-size/blob/8850e25fb088898e9cf86f9be1c401ad155bea86/src/libraries/AccountingLibrary.sol#L207",90
validation-462,Seller/Borrower is grieved by making him pay the swapFee for the fragmentionFees that goes to the protocol. - SellCreditMarketOrder.,"QA at most, fees",Satisfactory,"https://github.com/code-423n4/2024-06-size/blob/8850e25fb088898e9cf86f9be1c401ad155bea86/src/libraries/AccountingLibrary.sol#L249,https://github.com/code-423n4/2024-06-size/blob/8850e25fb088898e9cf86f9be1c401ad155bea86/src/libraries/AccountingLibrary.sol#L256",135
validation-463,Borrower can take the accrued Interest from the AAVE pool which is deserved by the thelender.,,Unsatisfactory,,74
validation-464,`liquidate()` doesn't have a deadline parameter makes it susceptible to MEV manipulation,,Unsatisfactory,,42
validation-465,DOS of  liquidateWithReplacement becuase issuance value might round to zero due to low apr and low tenor ,,Unsatisfactory,,41
validation-466,Fragmentation Fee not charged when a user incompletely compensate a credit position,no frag fee,Satisfactory,"https://github.com/code-423n4/2024-06-size/blob/main/src/libraries/actions/Compensate.sol#L136,https://github.com/code-423n4/2024-06-size/blob/main/src/libraries/actions/Compensate.sol#L146",68
validation-467,Setting `baseStalePriceInterval` and `quoteStalePriceInterval` as immutable possesses a risk,,Unsatisfactory,,27
validation-468,Pausing Prevents Closure and Liquidation of Outstanding Loan ,Acceptable risk but should be noted regardless,Satisfactory,https://github.com/code-423n4/2024-06-size/blob/main/src/libraries/RiskLibrary.sol#L104-L115,25
validation-469,Protocol Fee isn't collected in liquidate with replacement,no fee on replacement,Satisfactory,https://github.com/code-423n4/2024-06-size/blob/8850e25fb088898e9cf86f9be1c401ad155bea86/src/libraries/actions/LiquidateWithReplacement.sol#L146,53
validation-47,DoS on market order with `creditPositionId != RESERVED_ID` by front-run compensating the credit position with `creditPositionToCompensateId = RESERVED_ID` and `amount = type(uint256).max`,DoS via compensate of full position + 0,Satisfactory,https://github.com/code-423n4/2024-06-size/blob/8850e25fb088898e9cf86f9be1c401ad155bea86/src/libraries/actions/Compensate.sol#L56-L63,88
validation-471,"Attackers can steal repaid funds, by manipulating the ""liquidityIndex"".",unsat?,Unsatisfactory,,142
validation-472,Usage of an incorrect version of Ownable library ,,Unsatisfactory,,25
validation-473,Incorrect logic to protect Size from large amount of loans,,Unsatisfactory,,54
validation-474,Malicious lender can take over other lender's position,,Unsatisfactory,,133
validation-475,"Users can pay less fees for the same amount of cash, protocol losses expected income","QA at most, fees",Satisfactory,"https://github.com/code-423n4/2024-06-size/blob/8850e25fb088898e9cf86f9be1c401ad155bea86/src/libraries/AccountingLibrary.sol#L249,https://github.com/code-423n4/2024-06-size/blob/8850e25fb088898e9cf86f9be1c401ad155bea86/src/libraries/AccountingLibrary.sol#L256",434
validation-476,`_getPrice()` doesnt check for the `min`/`max` prices returned,,Unsatisfactory,,46
validation-477,Every borrower in Size can block the keeper from choosing them as a replacement borrower,,Unsatisfactory,,63
validation-480,`liquidatorReward` computation use `debtPosition.futureValue` in place of `debtInCollateralToken` in `Liquidate.sol`,units,Satisfactory,https://github.com/code-423n4/2024-06-size/blob/8850e25fb088898e9cf86f9be1c401ad155bea86/src/libraries/actions/Liquidate.sol#L96-L99,93
validation-481,An attacker can force a sellCreditMarket/buyCreditMarket call to match with a non-optimal offer by front-running the victim,,Unsatisfactory,,101
validation-482,`validateSellCreditMarket` may revert incorrectly when `params.amount` is used as `cashAmountOut/In` value (`exactAmountIn == false`,"QA at most, fees",Satisfactory,"https://github.com/code-423n4/2024-06-size/blob/8850e25fb088898e9cf86f9be1c401ad155bea86/src/libraries/AccountingLibrary.sol#L249,https://github.com/code-423n4/2024-06-size/blob/8850e25fb088898e9cf86f9be1c401ad155bea86/src/libraries/AccountingLibrary.sol#L256",101
validation-483,`validateBuyCreditMarket` may revert incorrectly when `params.amount` is used as `cashAmountIn` value (`exactAmountIn == true`),"QA at most, fees",Satisfactory,"https://github.com/code-423n4/2024-06-size/blob/8850e25fb088898e9cf86f9be1c401ad155bea86/src/libraries/AccountingLibrary.sol#L249,https://github.com/code-423n4/2024-06-size/blob/8850e25fb088898e9cf86f9be1c401ad155bea86/src/libraries/AccountingLibrary.sol#L256",101
validation-484,`liquidatorReward` calculation is not correct,units,Satisfactory,https://github.com/code-423n4/2024-06-size/blob/8850e25fb088898e9cf86f9be1c401ad155bea86/src/libraries/actions/Liquidate.sol#L96-L99,153
validation-485,"Partial repayment with debt/credit creation (compensation) will not charge fragmentation fee, allowing malicious actors to fragment a credit many times breaking invariant `FEES_01`",no frag fee,Satisfactory,"https://github.com/code-423n4/2024-06-size/blob/main/src/libraries/actions/Compensate.sol#L136,https://github.com/code-423n4/2024-06-size/blob/main/src/libraries/actions/Compensate.sol#L146",148
validation-487,the user can be frontrunned and forcefully liquidated,Acceptable risk but should be noted regardless,Satisfactory,https://github.com/code-423n4/2024-06-size/blob/main/src/libraries/RiskLibrary.sol#L104-L115,36
validation-488,Lenders can steal money from borrowers when market conditions are very volatile.,,Unsatisfactory,,100
validation-489,aave pool not integrated correctly ,,Unsatisfactory,,35
validation-49,"This vulnerability can lead to unauthorized configuration changes, potentially resulting in significant security and operational risks.",,Unsatisfactory,,46
validation-490,anyone can compensate with different token,,Unsatisfactory,,24
validation-491,anyone can repay with a different token,,Unsatisfactory,,23
validation-492,Borrower can make liquidation unprofitable for legitimate loans,,Unsatisfactory,,59
validation-493,Borrower can make liquidation unprofitable for legitimate loans,,Unsatisfactory,,59
validation-494,Aave Yield on Lender Credit Repayment Vulnerable to Griefing,,Satisfactory,https://github.com/code-423n4/2024-06-size/blob/main/src/libraries/actions/Claim.sol#L48-L60,122
validation-495,repay does not transfer excess,,Unsatisfactory,,26
validation-496,Incorrect Compensate Event Emission,"QA, event",Satisfactory,https://github.com/code-423n4/2024-06-size/blob/8850e25fb088898e9cf86f9be1c401ad155bea86/src/libraries/actions/Compensate.sol#L107-L109,76
validation-497,Incorrect Overdue Liquidation Protocol Fees Calculation,,Satisfactory,https://github.com/code-423n4/2024-06-size/blob/8850e25fb088898e9cf86f9be1c401ad155bea86/src/libraries/actions/Liquidate.sol#L105-L108,168
validation-498,Inability to Compensate Positions with Less Than 1 Hour Remaining,,Unsatisfactory,,62
validation-499,Inability to Compensate Positions with Less Than 1 Hour Remaining,,Unsatisfactory,,62
validation-500,Inability to Compensate Positions with Less Than 1 Hour Remaining,,Unsatisfactory,,62
validation-501,Borrower can make liquidation unprofitable for legitimate loans,,Unsatisfactory,,59
validation-502,Borrower can make liquidation unprofitable for legitimate loans,,Unsatisfactory,,59
validation-503,Ordinary liquidations can become unprofitable as expiration time cannot be set,,Unsatisfactory,,93
validation-504,Valid market lending and borrowing can be denied as `exactAmountIn` value is ignored in controls,incorrect restriction,Satisfactory,"https://github.com/code-423n4/2024-06-size/blob/8850e25fb088898e9cf86f9be1c401ad155bea86/src/libraries/actions/BuyCreditMarket.sol#L91-L93,https://github.com/code-423n4/2024-06-size/blob/8850e25fb088898e9cf86f9be1c401ad155bea86/src/libraries/actions/SellCreditMarket.sol#L93-L95",48
validation-505,"Due to wrong calculation of liquidator Reward, unexpected financial Loss of Protocol fee Recipient and Borrower is happening during Liquidation.",units,Satisfactory,https://github.com/code-423n4/2024-06-size/blob/8850e25fb088898e9cf86f9be1c401ad155bea86/src/libraries/actions/Liquidate.sol#L96-L99,92
validation-508,isMultiCall boolean value can be easily manipulated,"while correct, lack of multicall is a negative outcome",Unsatisfactory,,79
validation-510,"The accidental input of `state.data.underlyingBorrowToken.decimals()` instead of `state.data.underlyingCollateralToken.decimals()` in the `AccountingLibrary::debtTokenAmountToCollateralTokenAmount` function leads to unprofitable liquidations being mistakenly counted as profitable, causing the protocol to charge fees incorrectly and disrupting the liquidation process.",,Satisfactory,https://github.com/code-423n4/2024-06-size/blob/main/src/libraries/AccountingLibrary.sol#L31,91
validation-511,`LiquidateWithReplacement` function allows USDC blacklisted addresses to circumvent token-level restrictions through the Size protocol,,Unsatisfactory,,358
validation-512,"Inside Multicall, wrong parameters passed into state.validateBorrowATokenIncreaseLteDebtTokenDecrease allows for unintended behaviour where total supply of borrowAtokens exceed borrowATokenCap despite not being for the purpose of decreasing debt",total supply,Satisfactory,"https://github.com/code-423n4/2024-06-size/blob/8850e25fb088898e9cf86f9be1c401ad155bea86/src/libraries/Multicall.sol#L29,https://github.com/code-423n4/2024-06-size/blob/8850e25fb088898e9cf86f9be1c401ad155bea86/src/libraries/Multicall.sol#L37",63
validation-513,"The borrowAToken's scaling mechanism in `NonTransferrableScaledToken::transferFrom` by the LiquidityIndex through `getReserveNormalizedIncome`, introduces variability in token values via division or multiplication of the liquidity index, potentially affecting yield calculations within protocols.",,Unsatisfactory,,98
validation-514,Incorrect Handling of Decimal Places in Liquidation Reward Calculation,units,Satisfactory,https://github.com/code-423n4/2024-06-size/blob/8850e25fb088898e9cf86f9be1c401ad155bea86/src/libraries/actions/Liquidate.sol#L96-L99,112
validation-515,Inability to Update Aave Variable Pool Address in Configuration Update Function,,Unsatisfactory,,50
validation-516,H-01 buyCreditMarket() results in a lender losing funds due to buying a portion of a small credit,,Unsatisfactory,,85
validation-517,User Unable To Partially Repay Debt To Avoid Liquidation,,Unsatisfactory,,94
validation-520,Liquidators can steal borrowers collateral tokens due to wrong assumption.,,Unsatisfactory,,45
validation-521,Incorrect Handling of Cash Amount Validation in BuyCreditMarket Function,incorrect restriction,Satisfactory,"https://github.com/code-423n4/2024-06-size/blob/8850e25fb088898e9cf86f9be1c401ad155bea86/src/libraries/actions/BuyCreditMarket.sol#L91-L93,https://github.com/code-423n4/2024-06-size/blob/8850e25fb088898e9cf86f9be1c401ad155bea86/src/libraries/actions/SellCreditMarket.sol#L93-L95",48
validation-522,Lenders can cause a loss for Borrowers when they sell their credit positions,lender forcing loss for borrower by increasing APR? a maximum is enforced so..,Satisfactory,https://github.com/code-423n4/2024-06-size/blob/8850e25fb088898e9cf86f9be1c401ad155bea86/src/libraries/actions/SellCreditMarket.sol#L107-L118,127
validation-523,The `borrowATokenCap` will be reached earlier than expected,,Unsatisfactory,,51
validation-525,Overdue or underwater positions may become unliquidatable if there are not enough borrowATokens to repay lenders.,,Unsatisfactory,,87
validation-527,borrowers can't use some credit positions to compensate their debt positions,,Unsatisfactory,,77
validation-528,Certain configurations of liquidationRewardPercent could disincentivize liquidators,,Unsatisfactory,,51
validation-531,Liquidate & Self-Liquidate Should Have 100% Uptime,Acceptable risk but should be noted regardless,Satisfactory,https://github.com/code-423n4/2024-06-size/blob/main/src/libraries/RiskLibrary.sol#L104-L115,48
validation-532,APR Calculation is Favoring the Borrower Instead of the Lender,,Unsatisfactory,,30
validation-533,Protocol Profits Should Round in Favor of the Protocol and Not the Liquidated Borrower,,Unsatisfactory,,31
validation-534,"Users Can Place Offers That Are Never Collateralized, Leading to Many Dirty Orders in the Order Book",,Unsatisfactory,,88
validation-535,"Loan and Borrow Offers Are Not Being Reset After the User Deposit Has Been Used, Leaving Stale Orders on the Order Book.",,Unsatisfactory,,93
validation-536,"When both `low` and `high` are large enough value, overflow will occur",,Unsatisfactory,,37
validation-538,"When `sellCreditMarket()` is called to sell credit for a specific cash amount, the protocol might receive a lower swapping fee than expected.","QA at most, fees",Satisfactory,"https://github.com/code-423n4/2024-06-size/blob/8850e25fb088898e9cf86f9be1c401ad155bea86/src/libraries/AccountingLibrary.sol#L249,https://github.com/code-423n4/2024-06-size/blob/8850e25fb088898e9cf86f9be1c401ad155bea86/src/libraries/AccountingLibrary.sol#L256",213
validation-540,Incorrect calculation of liquidation rewards results in all liquidations being profitless,units,Satisfactory,https://github.com/code-423n4/2024-06-size/blob/8850e25fb088898e9cf86f9be1c401ad155bea86/src/libraries/actions/Liquidate.sol#L96-L99,122
validation-541,Lenders are not getting interest from AAVE when claiming,,Unsatisfactory,,102
validation-542,The `borrowATokenCap` limitation can be bypassed by depositing `USDC` through `Size#multicall()`,total supply,Satisfactory,"https://github.com/code-423n4/2024-06-size/blob/8850e25fb088898e9cf86f9be1c401ad155bea86/src/libraries/Multicall.sol#L29,https://github.com/code-423n4/2024-06-size/blob/8850e25fb088898e9cf86f9be1c401ad155bea86/src/libraries/Multicall.sol#L37",76
validation-543,Incorrect address was used to check whether the variable pool has enough liquidity ,interesting aave,Satisfactory,https://github.com/code-423n4/2024-06-size/blob/main/src/libraries/CapsLibrary.sol#L67-L72,61
validation-544,Neither `sellCreditMarket()` nor `compensate()` checks whether the credit position to be sold is allowed for sale,,Unsatisfactory,,269
validation-545,DoS when trying to access the newly created debit & credit position,,Unsatisfactory,,124
validation-546,All transactions in which CapsLibrary::validateVariablePoolHasEnoughLiquidity is called revert,interesting aave,Satisfactory,https://github.com/code-423n4/2024-06-size/blob/main/src/libraries/CapsLibrary.sol#L67-L72,35
validation-547,`getCreditAmountIn` returns lower fees than expected,"QA at most, fees",Satisfactory,"https://github.com/code-423n4/2024-06-size/blob/8850e25fb088898e9cf86f9be1c401ad155bea86/src/libraries/AccountingLibrary.sol#L249,https://github.com/code-423n4/2024-06-size/blob/8850e25fb088898e9cf86f9be1c401ad155bea86/src/libraries/AccountingLibrary.sol#L256",59
validation-548,"`SellCreditLimit` function allows blacklisted addresses to create borrow offers, bypassing USDC restrictions",,Unsatisfactory,,335
validation-550,AccountingLibrary::getCreditAmountIn ensures that borrowers end up paying more for fragmentation than specified in fee config ,fee 2 getCreditAmountIn ,Satisfactory,"https://github.com/code-423n4/2024-06-size/blob/8850e25fb088898e9cf86f9be1c401ad155bea86/src/libraries/AccountingLibrary.sol#L197,https://github.com/code-423n4/2024-06-size/blob/8850e25fb088898e9cf86f9be1c401ad155bea86/src/libraries/AccountingLibrary.sol#L207",59
validation-551,Wrong liquidity checking lead to token being stuck,interesting,Satisfactory,https://github.com/code-423n4/2024-06-size/blob/main/src/libraries/CapsLibrary.sol#L67-L72,91
validation-552,It doesn't validate `variablePoolBorrowRateStaleRateInterval` when `Size#updateConfig()` is called to update `variablePoolBorrowRateStaleRateInterval`,,Unsatisfactory,,139
validation-554,Decimal error in calculation of the liquidator's reward,units,Satisfactory,https://github.com/code-423n4/2024-06-size/blob/8850e25fb088898e9cf86f9be1c401ad155bea86/src/libraries/actions/Liquidate.sol#L96-L99,89
validation-555, Uncharged Fragmentation Fees on Credit Splits on `Compnsate()` function Lead to Financial Losses for the Protocol,no frag fee,Satisfactory,"https://github.com/code-423n4/2024-06-size/blob/main/src/libraries/actions/Compensate.sol#L136,https://github.com/code-423n4/2024-06-size/blob/main/src/libraries/actions/Compensate.sol#L146",125
validation-556,`borrowATokenCap` can be avoided by using the `Multicall` function,total supply,Satisfactory,"https://github.com/code-423n4/2024-06-size/blob/8850e25fb088898e9cf86f9be1c401ad155bea86/src/libraries/Multicall.sol#L29,https://github.com/code-423n4/2024-06-size/blob/8850e25fb088898e9cf86f9be1c401ad155bea86/src/libraries/Multicall.sol#L37",85
validation-557,No Incentive for Liquidation Due to Incorrect Calculation of Liquidator Rewards,units,Satisfactory,https://github.com/code-423n4/2024-06-size/blob/8850e25fb088898e9cf86f9be1c401ad155bea86/src/libraries/actions/Liquidate.sol#L96-L99,116
validation-558,"Liquidator reward is calculated wrongly, causing it to be extremely low, not incentivising for liquidations to be made",units,Satisfactory,https://github.com/code-423n4/2024-06-size/blob/8850e25fb088898e9cf86f9be1c401ad155bea86/src/libraries/actions/Liquidate.sol#L96-L99,52
validation-559,Incorrect Liquidity Check in Variable Pool Disrupts Borrowing Operations,interesting,Satisfactory,https://github.com/code-423n4/2024-06-size/blob/main/src/libraries/CapsLibrary.sol#L67-L72,107
validation-561,`validateVariablePoolHasEnoughLiquidity`'s checking condition can be bypassed.,,Unsatisfactory,,39
validation-562,Incorrect Validation of `Amount` in `sellCreditMarket` and `buyCreditMarket` Functions Causes A Revert On Valid Inputs,incorrect restriction,Satisfactory,"https://github.com/code-423n4/2024-06-size/blob/8850e25fb088898e9cf86f9be1c401ad155bea86/src/libraries/actions/BuyCreditMarket.sol#L91-L93,https://github.com/code-423n4/2024-06-size/blob/8850e25fb088898e9cf86f9be1c401ad155bea86/src/libraries/actions/SellCreditMarket.sol#L93-L95",99
validation-563,Frontrunning risk for `setUserConfiguration` function for very profitable CreditPositions,,Unsatisfactory,,33
validation-564,Borrower are not able to repay debt when protocol is paused.,Acceptable risk but should be noted regardless,Satisfactory,https://github.com/code-423n4/2024-06-size/blob/main/src/libraries/RiskLibrary.sol#L104-L115,29
validation-565,worng calculation of creditAmountIn in `sellCreditMarket` gives the borrower less `cashOut`,"QA at most, fees",Satisfactory,"https://github.com/code-423n4/2024-06-size/blob/8850e25fb088898e9cf86f9be1c401ad155bea86/src/libraries/AccountingLibrary.sol#L249,https://github.com/code-423n4/2024-06-size/blob/8850e25fb088898e9cf86f9be1c401ad155bea86/src/libraries/AccountingLibrary.sol#L256",157
validation-566,Unprofitable Liquidation for Small Loans Leads to Bad Debt,"QA, small loan profitability liquidation",Satisfactory,https://github.com/code-423n4/2024-06-size/blob/8850e25fb088898e9cf86f9be1c401ad155bea86/src/libraries/actions/Liquidate.sol#L96-L100,80
validation-567,"when a borrow Order is filled via Size::liquidateWithReplacement, the borrower does not end up paying for swap fees",no fee on replacement,Satisfactory,https://github.com/code-423n4/2024-06-size/blob/8850e25fb088898e9cf86f9be1c401ad155bea86/src/libraries/actions/LiquidateWithReplacement.sol#L146,22
validation-568,Incorrect calculation for liquidatorReward in executeLiquidate function,units,Satisfactory,https://github.com/code-423n4/2024-06-size/blob/8850e25fb088898e9cf86f9be1c401ad155bea86/src/libraries/actions/Liquidate.sol#L96-L99,88
validation-569,`liquidatorProfitBorrowToken` send to wrong address,,Unsatisfactory,,46
validation-570,There is a discrepancy in which party pays the fragmentation fee depending on whether buyMarketCredit or sellMarketCredit is used,inconsistent fragmentation fee charging,Satisfactory,"https://github.com/code-423n4/2024-06-size/blob/8850e25fb088898e9cf86f9be1c401ad155bea86/src/libraries/AccountingLibrary.sol#L207-L213,https://github.com/code-423n4/2024-06-size/blob/8850e25fb088898e9cf86f9be1c401ad155bea86/src/libraries/AccountingLibrary.sol#L294",144
validation-571,Lack of function `claimReward()` to claim reward,,Unsatisfactory,,34
validation-572,Lenders can set extremely high interest rate on loans. ,,Unsatisfactory,,70
validation-574,borrowATokenCap can be exceeded without adding value to the protocol.,"QA, multicall",Satisfactory,https://github.com/code-423n4/2024-06-size/blob/main/src/libraries/CapsLibrary.sol#L19-L44,97
validation-575,minTenor check in validateCompensate() will DOS loan compensation,,Unsatisfactory,,54
validation-576,Liquidators can prevent users from making their positions healthy during an unpause.,Acceptable risk but should be noted regardless,Satisfactory,https://github.com/code-423n4/2024-06-size/blob/main/src/libraries/RiskLibrary.sol#L104-L115,39
validation-578,Incorrect validation in Size.sol causes unexpected reverts,fee 2 getCreditAmountIn ,Satisfactory,"https://github.com/code-423n4/2024-06-size/blob/8850e25fb088898e9cf86f9be1c401ad155bea86/src/libraries/AccountingLibrary.sol#L197,https://github.com/code-423n4/2024-06-size/blob/8850e25fb088898e9cf86f9be1c401ad155bea86/src/libraries/AccountingLibrary.sol#L207",31
validation-579,"Credit positions can be bought instantly, which may lead to lenders losing funds",,Unsatisfactory,,127
validation-580,H-02 createDebtAndCreditPositions() and createCreditPosition() may result in backrunning exploit of user's loanOffer,immediate for sale exploit,Satisfactory,https://github.com/code-423n4/2024-06-size/blob/8850e25fb088898e9cf86f9be1c401ad155bea86/src/libraries/AccountingLibrary.sol#L81,100
validation-581,Chainlink's `latestRoundData` Might Return Stale Results,,Unsatisfactory,,37
validation-582,Liquidator reward is calculated wrongly ,units,Satisfactory,https://github.com/code-423n4/2024-06-size/blob/8850e25fb088898e9cf86f9be1c401ad155bea86/src/libraries/actions/Liquidate.sol#L96-L99,69
validation-584,`liquidatorReward` calculated incorrectly resulting in liquidator receiving dust fees,units,Satisfactory,https://github.com/code-423n4/2024-06-size/blob/8850e25fb088898e9cf86f9be1c401ad155bea86/src/libraries/actions/Liquidate.sol#L96-L99,114
validation-585,Liquidator receives a dust amount as a reward due to an incorrect calculation of the liquidatorProfitCollateralToken,units,Satisfactory,https://github.com/code-423n4/2024-06-size/blob/8850e25fb088898e9cf86f9be1c401ad155bea86/src/libraries/actions/Liquidate.sol#L96-L99,75
validation-586,"Some liquidations are not properly incentivized due to gas prices exceeding liquidation rewards, especially on Ethereum mainnet",,Unsatisfactory,,91
validation-587,Inaccurate Liquidatability Assessment Due to Omission of Protocol Fees,,Unsatisfactory,,80
validation-588,"Borrowers who call `compensate()` with `RESERVED_ID` will never pay a fragmentation fee, despite being responsible for the fragmentation of credit",no frag fee,Satisfactory,"https://github.com/code-423n4/2024-06-size/blob/main/src/libraries/actions/Compensate.sol#L136,https://github.com/code-423n4/2024-06-size/blob/main/src/libraries/actions/Compensate.sol#L146",134
validation-590,Users Can Steal ETH Balance with Minimum Investment,,Unsatisfactory,,65
validation-592,Borrowers pay more credit than necessary,"QA at most, fees",Satisfactory,"https://github.com/code-423n4/2024-06-size/blob/8850e25fb088898e9cf86f9be1c401ad155bea86/src/libraries/AccountingLibrary.sol#L249,https://github.com/code-423n4/2024-06-size/blob/8850e25fb088898e9cf86f9be1c401ad155bea86/src/libraries/AccountingLibrary.sol#L256",67
validation-593,Through `liquidateWithReplacement` a borrower can avoid paying swap fees,no fee on replacement,Satisfactory,https://github.com/code-423n4/2024-06-size/blob/8850e25fb088898e9cf86f9be1c401ad155bea86/src/libraries/actions/LiquidateWithReplacement.sol#L146,37
validation-594,Incorrect ```liquidatorReward``` calculation due to using ```debtPosition.futureValue``` instead of ```debtInCollateralToken```.,units,Satisfactory,https://github.com/code-423n4/2024-06-size/blob/8850e25fb088898e9cf86f9be1c401ad155bea86/src/libraries/actions/Liquidate.sol#L96-L99,59
validation-595,"Incomplete validation check in the [Claim::executeClaim], a lender can claim a token before its duedate of repayment without the borrower acknowledgement/approval",,Unsatisfactory,,65
validation-596,Malicious user can DoS every deposit of ```USDC``` at no cost by sandwiching it to not passing ```validateBorrowATokenCap``` check.,,Unsatisfactory,,63
